c [Version] Cyclic Bandwidth Encoder version 1.0.0.
c [Param] Real time limit is set to 150.
c [Param] Memory limit is set to 30000.
c [Param] Worker count is set to 8.
c [Main] Encoding and solving for graph: 3dmesh_6_6_72.txt.
c [Main] Search strategy: Binary search from lower bound.
c [Main] No predefined lower bound is found for 3dmesh_6_6_72.txt.
c [Main] LB-w = 2 (default value).
c [Main] Upper bound is set to 1278.
c [Main] Search order: 640 320 160 80 40 20 10 5 3 2 4 7 6 8 9 15 12 11 13 14 17 16 18 19 30 25 22 21 23 24 27 26 28 29 35 32 31 33 34 37 36 38 39 60 50 45 42 41 43 44 47 46 48 49 55 52 51 53 54 57 56 58 59 70 65 62 61 63 64 67 66 68 69 75 72 71 73 74 77 76 78 79 120 100 90 85 82 81 83 84 87 86 88 89 95 92 91 93 94 97 96 98 99 110 105 102 101 103 104 107 106 108 109 115 112 111 113 114 117 116 118 119 140 130 125 122 121 123 124 127 126 128 129 135 132 131 133 134 137 136 138 139 150 145 142 141 143 144 147 146 148 149 155 152 151 153 154 157 156 158 159 240 200 180 170 165 162 161 163 164 167 166 168 169 175 172 171 173 174 177 176 178 179 190 185 182 181 183 184 187 186 188 189 195 192 191 193 194 197 196 198 199 220 210 205 202 201 203 204 207 206 208 209 215 212 211 213 214 217 216 218 219 230 225 222 221 223 224 227 226 228 229 235 232 231 233 234 237 236 238 239 280 260 250 245 242 241 243 244 247 246 248 249 255 252 251 253 254 257 256 258 259 270 265 262 261 263 264 267 266 268 269 275 272 271 273 274 277 276 278 279 300 290 285 282 281 283 284 287 286 288 289 295 292 291 293 294 297 296 298 299 310 305 302 301 303 304 307 306 308 309 315 312 311 313 314 317 316 318 319 480 400 360 340 330 325 322 321 323 324 327 326 328 329 335 332 331 333 334 337 336 338 339 350 345 342 341 343 344 347 346 348 349 355 352 351 353 354 357 356 358 359 380 370 365 362 361 363 364 367 366 368 369 375 372 371 373 374 377 376 378 379 390 385 382 381 383 384 387 386 388 389 395 392 391 393 394 397 396 398 399 440 420 410 405 402 401 403 404 407 406 408 409 415 412 411 413 414 417 416 418 419 430 425 422 421 423 424 427 426 428 429 435 432 431 433 434 437 436 438 439 460 450 445 442 441 443 444 447 446 448 449 455 452 451 453 454 457 456 458 459 470 465 462 461 463 464 467 466 468 469 475 472 471 473 474 477 476 478 479 560 520 500 490 485 482 481 483 484 487 486 488 489 495 492 491 493 494 497 496 498 499 510 505 502 501 503 504 507 506 508 509 515 512 511 513 514 517 516 518 519 540 530 525 522 521 523 524 527 526 528 529 535 532 531 533 534 537 536 538 539 550 545 542 541 543 544 547 546 548 549 555 552 551 553 554 557 556 558 559 600 580 570 565 562 561 563 564 567 566 568 569 575 572 571 573 574 577 576 578 579 590 585 582 581 583 584 587 586 588 589 595 592 591 593 594 597 596 598 599 620 610 605 602 601 603 604 607 606 608 609 615 612 611 613 614 617 616 618 619 630 625 622 621 623 624 627 626 628 629 635 632 631 633 634 637 636 638 639 959 799 719 679 659 649 644 642 641 643 646 645 647 648 654 651 650 652 653 656 655 657 658 669 664 661 660 662 663 666 665 667 668 674 671 670 672 673 676 675 677 678 699 689 684 681 680 682 683 686 685 687 688 694 691 690 692 693 696 695 697 698 709 704 701 700 702 703 706 705 707 708 714 711 710 712 713 716 715 717 718 759 739 729 724 721 720 722 723 726 725 727 728 734 731 730 732 733 736 735 737 738 749 744 741 740 742 743 746 745 747 748 754 751 750 752 753 756 755 757 758 779 769 764 761 760 762 763 766 765 767 768 774 771 770 772 773 776 775 777 778 789 784 781 780 782 783 786 785 787 788 794 791 790 792 793 796 795 797 798 879 839 819 809 804 801 800 802 803 806 805 807 808 814 811 810 812 813 816 815 817 818 829 824 821 820 822 823 826 825 827 828 834 831 830 832 833 836 835 837 838 859 849 844 841 840 842 843 846 845 847 848 854 851 850 852 853 856 855 857 858 869 864 861 860 862 863 866 865 867 868 874 871 870 872 873 876 875 877 878 919 899 889 884 881 880 882 883 886 885 887 888 894 891 890 892 893 896 895 897 898 909 904 901 900 902 903 906 905 907 908 914 911 910 912 913 916 915 917 918 939 929 924 921 920 922 923 926 925 927 928 934 931 930 932 933 936 935 937 938 949 944 941 940 942 943 946 945 947 948 954 951 950 952 953 956 955 957 958 1119 1039 999 979 969 964 961 960 962 963 966 965 967 968 974 971 970 972 973 976 975 977 978 989 984 981 980 982 983 986 985 987 988 994 991 990 992 993 996 995 997 998 1019 1009 1004 1001 1000 1002 1003 1006 1005 1007 1008 1014 1011 1010 1012 1013 1016 1015 1017 1018 1029 1024 1021 1020 1022 1023 1026 1025 1027 1028 1034 1031 1030 1032 1033 1036 1035 1037 1038 1079 1059 1049 1044 1041 1040 1042 1043 1046 1045 1047 1048 1054 1051 1050 1052 1053 1056 1055 1057 1058 1069 1064 1061 1060 1062 1063 1066 1065 1067 1068 1074 1071 1070 1072 1073 1076 1075 1077 1078 1099 1089 1084 1081 1080 1082 1083 1086 1085 1087 1088 1094 1091 1090 1092 1093 1096 1095 1097 1098 1109 1104 1101 1100 1102 1103 1106 1105 1107 1108 1114 1111 1110 1112 1113 1116 1115 1117 1118 1199 1159 1139 1129 1124 1121 1120 1122 1123 1126 1125 1127 1128 1134 1131 1130 1132 1133 1136 1135 1137 1138 1149 1144 1141 1140 1142 1143 1146 1145 1147 1148 1154 1151 1150 1152 1153 1156 1155 1157 1158 1179 1169 1164 1161 1160 1162 1163 1166 1165 1167 1168 1174 1171 1170 1172 1173 1176 1175 1177 1178 1189 1184 1181 1180 1182 1183 1186 1185 1187 1188 1194 1191 1190 1192 1193 1196 1195 1197 1198 1239 1219 1209 1204 1201 1200 1202 1203 1206 1205 1207 1208 1214 1211 1210 1212 1213 1216 1215 1217 1218 1229 1224 1221 1220 1222 1223 1226 1225 1227 1228 1234 1231 1230 1232 1233 1236 1235 1237 1238 1259 1249 1244 1241 1240 1242 1243 1246 1245 1247 1248 1254 1251 1250 1252 1253 1256 1255 1257 1258 1269 1264 1261 1260 1262 1263 1266 1265 1267 1268 1274 1271 1270 1272 1273 1276 1275 1277 1278.
c [w = 10] Start task in PID: 12522.
c [w = 10] Cyclic Antibandwidth problem with w = 10 (3dmesh_6_6_72.txt):
c [w = 10] Initializing CaDiCaL (version 2.1.3).
c [w = 10] Configuring CaDiCaL as --sat (1).
c [w = 10] Encoding starts with w = 10:
c [w = 10] Symmetry breaking highest degree node is applied.
c [Signal] Signal interruption. Caught signal: SIGTERM (15).
c [Main] Lim pid ends with result: 255.
c [Main] All children have completed.
r [Main] 
r [Main] Final results: 
r [Main] Max width SAT:  	-.
r [Main] Min width UNSAT:	-.
r [Main] Total real time: 17460 ms.
r [Main] Total memory consumed: 30163.6 MB.
r [Main] 
c [w = 40] Start task in PID: 12520.
c [w = 40] Cyclic Antibandwidth problem with w = 40 (3dmesh_6_6_72.txt):
c [w = 40] Initializing CaDiCaL (version 2.1.3).
c [w = 40] Configuring CaDiCaL as --sat (1).
c [w = 40] Encoding starts with w = 40:
c [w = 40] Symmetry breaking highest degree node is applied.
c [Signal] Signal interruption. Caught signal: SIGTERM (15).
c [w = 320] Start task in PID: 12517.
c [w = 320] Cyclic Antibandwidth problem with w = 320 (3dmesh_6_6_72.txt):
c [w = 320] Initializing CaDiCaL (version 2.1.3).
c [w = 320] Configuring CaDiCaL as --sat (1).
c [w = 320] Encoding starts with w = 320:
c [w = 320] Symmetry breaking highest degree node is applied.
c [Signal] Signal interruption. Caught signal: SIGTERM (15).
c [w = 5] Start task in PID: 12523.
c [w = 5] Cyclic Antibandwidth problem with w = 5 (3dmesh_6_6_72.txt):
c [w = 5] Initializing CaDiCaL (version 2.1.3).
c [w = 5] Configuring CaDiCaL as --sat (1).
c [w = 5] Encoding starts with w = 5:
c [w = 5] Symmetry breaking highest degree node is applied.
c [Signal] Signal interruption. Caught signal: SIGTERM (15).
c [w = 160] Start task in PID: 12518.
c [w = 160] Cyclic Antibandwidth problem with w = 160 (3dmesh_6_6_72.txt):
c [w = 160] Initializing CaDiCaL (version 2.1.3).
c [w = 160] Configuring CaDiCaL as --sat (1).
c [w = 160] Encoding starts with w = 160:
c [w = 160] Symmetry breaking highest degree node is applied.
c [Signal] Signal interruption. Caught signal: SIGTERM (15).
c [w = 20] Start task in PID: 12521.
c [w = 20] Cyclic Antibandwidth problem with w = 20 (3dmesh_6_6_72.txt):
c [w = 20] Initializing CaDiCaL (version 2.1.3).
c [w = 20] Configuring CaDiCaL as --sat (1).
c [w = 20] Encoding starts with w = 20:
c [w = 20] Symmetry breaking highest degree node is applied.
c [Signal] Signal interruption. Caught signal: SIGTERM (15).
c [w = 80] Start task in PID: 12519.
c [w = 80] Cyclic Antibandwidth problem with w = 80 (3dmesh_6_6_72.txt):
c [w = 80] Initializing CaDiCaL (version 2.1.3).
c [w = 80] Configuring CaDiCaL as --sat (1).
c [w = 80] Encoding starts with w = 80:
c [w = 80] Symmetry breaking highest degree node is applied.
c [Signal] Signal interruption. Caught signal: SIGTERM (15).
c [w = 640] Start task in PID: 12516.
c [w = 640] Cyclic Antibandwidth problem with w = 640 (3dmesh_6_6_72.txt):
c [w = 640] Initializing CaDiCaL (version 2.1.3).
c [w = 640] Configuring CaDiCaL as --sat (1).
c [w = 640] Encoding starts with w = 640:
c [w = 640] Symmetry breaking highest degree node is applied.
c [Signal] Signal interruption. Caught signal: SIGTERM (15).
