c [Version] Cyclic Bandwidth Encoder version 1.0.0.
c [Param] Real time limit is set to 150.
c [Param] Memory limit is set to 30000.
c [Param] Worker count is set to 8.
c [Main] Encoding and solving for graph: 3dmesh_6_6_72.txt.
c [Main] Search strategy: Binary search from lower bound.
c [Main] No predefined lower bound is found for 3dmesh_6_6_72.txt.
c [Main] LB-w = 2 (default value).
c [Main] Upper bound is set to 1277.
c [Main] Search order: 639 320 160 80 40 20 10 5 3 2 4 7 6 8 9 15 12 11 13 14 17 16 18 19 30 25 22 21 23 24 27 26 28 29 35 32 31 33 34 37 36 38 39 60 50 45 42 41 43 44 47 46 48 49 55 52 51 53 54 57 56 58 59 70 65 62 61 63 64 67 66 68 69 75 72 71 73 74 77 76 78 79 120 100 90 85 82 81 83 84 87 86 88 89 95 92 91 93 94 97 96 98 99 110 105 102 101 103 104 107 106 108 109 115 112 111 113 114 117 116 118 119 140 130 125 122 121 123 124 127 126 128 129 135 132 131 133 134 137 136 138 139 150 145 142 141 143 144 147 146 148 149 155 152 151 153 154 157 156 158 159 240 200 180 170 165 162 161 163 164 167 166 168 169 175 172 171 173 174 177 176 178 179 190 185 182 181 183 184 187 186 188 189 195 192 191 193 194 197 196 198 199 220 210 205 202 201 203 204 207 206 208 209 215 212 211 213 214 217 216 218 219 230 225 222 221 223 224 227 226 228 229 235 232 231 233 234 237 236 238 239 280 260 250 245 242 241 243 244 247 246 248 249 255 252 251 253 254 257 256 258 259 270 265 262 261 263 264 267 266 268 269 275 272 271 273 274 277 276 278 279 300 290 285 282 281 283 284 287 286 288 289 295 292 291 293 294 297 296 298 299 310 305 302 301 303 304 307 306 308 309 315 312 311 313 314 317 316 318 319 479 399 359 339 329 324 322 321 323 326 325 327 328 334 331 330 332 333 336 335 337 338 349 344 341 340 342 343 346 345 347 348 354 351 350 352 353 356 355 357 358 379 369 364 361 360 362 363 366 365 367 368 374 371 370 372 373 376 375 377 378 389 384 381 380 382 383 386 385 387 388 394 391 390 392 393 396 395 397 398 439 419 409 404 401 400 402 403 406 405 407 408 414 411 410 412 413 416 415 417 418 429 424 421 420 422 423 426 425 427 428 434 431 430 432 433 436 435 437 438 459 449 444 441 440 442 443 446 445 447 448 454 451 450 452 453 456 455 457 458 469 464 461 460 462 463 466 465 467 468 474 471 470 472 473 476 475 477 478 559 519 499 489 484 481 480 482 483 486 485 487 488 494 491 490 492 493 496 495 497 498 509 504 501 500 502 503 506 505 507 508 514 511 510 512 513 516 515 517 518 539 529 524 521 520 522 523 526 525 527 528 534 531 530 532 533 536 535 537 538 549 544 541 540 542 543 546 545 547 548 554 551 550 552 553 556 555 557 558 599 579 569 564 561 560 562 563 566 565 567 568 574 571 570 572 573 576 575 577 578 589 584 581 580 582 583 586 585 587 588 594 591 590 592 593 596 595 597 598 619 609 604 601 600 602 603 606 605 607 608 614 611 610 612 613 616 615 617 618 629 624 621 620 622 623 626 625 627 628 634 631 630 632 633 636 635 637 638 958 798 718 678 658 648 643 641 640 642 645 644 646 647 653 650 649 651 652 655 654 656 657 668 663 660 659 661 662 665 664 666 667 673 670 669 671 672 675 674 676 677 698 688 683 680 679 681 682 685 684 686 687 693 690 689 691 692 695 694 696 697 708 703 700 699 701 702 705 704 706 707 713 710 709 711 712 715 714 716 717 758 738 728 723 720 719 721 722 725 724 726 727 733 730 729 731 732 735 734 736 737 748 743 740 739 741 742 745 744 746 747 753 750 749 751 752 755 754 756 757 778 768 763 760 759 761 762 765 764 766 767 773 770 769 771 772 775 774 776 777 788 783 780 779 781 782 785 784 786 787 793 790 789 791 792 795 794 796 797 878 838 818 808 803 800 799 801 802 805 804 806 807 813 810 809 811 812 815 814 816 817 828 823 820 819 821 822 825 824 826 827 833 830 829 831 832 835 834 836 837 858 848 843 840 839 841 842 845 844 846 847 853 850 849 851 852 855 854 856 857 868 863 860 859 861 862 865 864 866 867 873 870 869 871 872 875 874 876 877 918 898 888 883 880 879 881 882 885 884 886 887 893 890 889 891 892 895 894 896 897 908 903 900 899 901 902 905 904 906 907 913 910 909 911 912 915 914 916 917 938 928 923 920 919 921 922 925 924 926 927 933 930 929 931 932 935 934 936 937 948 943 940 939 941 942 945 944 946 947 953 950 949 951 952 955 954 956 957 1118 1038 998 978 968 963 960 959 961 962 965 964 966 967 973 970 969 971 972 975 974 976 977 988 983 980 979 981 982 985 984 986 987 993 990 989 991 992 995 994 996 997 1018 1008 1003 1000 999 1001 1002 1005 1004 1006 1007 1013 1010 1009 1011 1012 1015 1014 1016 1017 1028 1023 1020 1019 1021 1022 1025 1024 1026 1027 1033 1030 1029 1031 1032 1035 1034 1036 1037 1078 1058 1048 1043 1040 1039 1041 1042 1045 1044 1046 1047 1053 1050 1049 1051 1052 1055 1054 1056 1057 1068 1063 1060 1059 1061 1062 1065 1064 1066 1067 1073 1070 1069 1071 1072 1075 1074 1076 1077 1098 1088 1083 1080 1079 1081 1082 1085 1084 1086 1087 1093 1090 1089 1091 1092 1095 1094 1096 1097 1108 1103 1100 1099 1101 1102 1105 1104 1106 1107 1113 1110 1109 1111 1112 1115 1114 1116 1117 1198 1158 1138 1128 1123 1120 1119 1121 1122 1125 1124 1126 1127 1133 1130 1129 1131 1132 1135 1134 1136 1137 1148 1143 1140 1139 1141 1142 1145 1144 1146 1147 1153 1150 1149 1151 1152 1155 1154 1156 1157 1178 1168 1163 1160 1159 1161 1162 1165 1164 1166 1167 1173 1170 1169 1171 1172 1175 1174 1176 1177 1188 1183 1180 1179 1181 1182 1185 1184 1186 1187 1193 1190 1189 1191 1192 1195 1194 1196 1197 1238 1218 1208 1203 1200 1199 1201 1202 1205 1204 1206 1207 1213 1210 1209 1211 1212 1215 1214 1216 1217 1228 1223 1220 1219 1221 1222 1225 1224 1226 1227 1233 1230 1229 1231 1232 1235 1234 1236 1237 1258 1248 1243 1240 1239 1241 1242 1245 1244 1246 1247 1253 1250 1249 1251 1252 1255 1254 1256 1257 1268 1263 1260 1259 1261 1262 1265 1264 1266 1267 1273 1270 1269 1271 1272 1275 1274 1276 1277.
c [w = 20] Start task in PID: 18959.
c [w = 20] Cyclic Antibandwidth problem with w = 20 (3dmesh_6_6_72.txt):
c [w = 20] Initializing CaDiCaL (version 2.1.3).
c [w = 20] Configuring CaDiCaL as --sat (1).
c [w = 20] Encoding starts with w = 20:
c [w = 20] Symmetry breaking highest degree node is applied.
c [Signal] Signal interruption. Caught signal: SIGTERM (15).
c [w = 10] Start task in PID: 18960.
c [w = 10] Cyclic Antibandwidth problem with w = 10 (3dmesh_6_6_72.txt):
c [w = 10] Initializing CaDiCaL (version 2.1.3).
c [w = 10] Configuring CaDiCaL as --sat (1).
c [w = 10] Encoding starts with w = 10:
c [w = 10] Symmetry breaking highest degree node is applied.
c [Signal] Signal interruption. Caught signal: SIGTERM (15).
c [w = 160] Start task in PID: 18956.
c [w = 160] Cyclic Antibandwidth problem with w = 160 (3dmesh_6_6_72.txt):
c [w = 160] Initializing CaDiCaL (version 2.1.3).
c [w = 160] Configuring CaDiCaL as --sat (1).
c [w = 160] Encoding starts with w = 160:
c [w = 160] Symmetry breaking highest degree node is applied.
c [Signal] Signal interruption. Caught signal: SIGTERM (15).
c [w = 639] Start task in PID: 18954.
c [w = 639] Cyclic Antibandwidth problem with w = 639 (3dmesh_6_6_72.txt):
c [w = 639] Initializing CaDiCaL (version 2.1.3).
c [w = 639] Configuring CaDiCaL as --sat (1).
c [w = 639] Encoding starts with w = 639:
c [w = 639] Symmetry breaking highest degree node is applied.
c [Signal] Signal interruption. Caught signal: SIGTERM (15).
c [w = 320] Start task in PID: 18955.
c [w = 320] Cyclic Antibandwidth problem with w = 320 (3dmesh_6_6_72.txt):
c [w = 320] Initializing CaDiCaL (version 2.1.3).
c [w = 320] Configuring CaDiCaL as --sat (1).
c [w = 320] Encoding starts with w = 320:
c [w = 320] Symmetry breaking highest degree node is applied.
c [Signal] Signal interruption. Caught signal: SIGTERM (15).
c [Main] Lim pid ends with result: 255.
c [Main] All children have completed.
r [Main] 
r [Main] Final results: 
r [Main] Max width SAT:  	-.
r [Main] Min width UNSAT:	-.
r [Main] Total real time: 7950 ms.
r [Main] Total memory consumed: 30890 MB.
r [Main] 
c [w = 80] Start task in PID: 18957.
c [w = 80] Cyclic Antibandwidth problem with w = 80 (3dmesh_6_6_72.txt):
c [w = 80] Initializing CaDiCaL (version 2.1.3).
c [w = 80] Configuring CaDiCaL as --sat (1).
c [w = 80] Encoding starts with w = 80:
c [w = 80] Symmetry breaking highest degree node is applied.
c [Signal] Signal interruption. Caught signal: SIGTERM (15).
c [w = 5] Start task in PID: 18961.
c [w = 5] Cyclic Antibandwidth problem with w = 5 (3dmesh_6_6_72.txt):
c [w = 5] Initializing CaDiCaL (version 2.1.3).
c [w = 5] Configuring CaDiCaL as --sat (1).
c [w = 5] Encoding starts with w = 5:
c [w = 5] Symmetry breaking highest degree node is applied.
c [Signal] Signal interruption. Caught signal: SIGTERM (15).
c [w = 40] Start task in PID: 18958.
c [w = 40] Cyclic Antibandwidth problem with w = 40 (3dmesh_6_6_72.txt):
c [w = 40] Initializing CaDiCaL (version 2.1.3).
c [w = 40] Configuring CaDiCaL as --sat (1).
c [w = 40] Encoding starts with w = 40:
c [w = 40] Symmetry breaking highest degree node is applied.
c [Signal] Signal interruption. Caught signal: SIGTERM (15).
