c [Version] Cyclic Bandwidth Encoder version 1.0.0.
c [Param] Real time limit is set to 150.
c [Param] Memory limit is set to 30000.
c [Param] Worker count is set to 8.
c [Main] Encoding and solving for graph: 3dmesh_6_6_8.txt.
c [Main] Search strategy: Binary search from lower bound.
c [Main] No predefined lower bound is found for 3dmesh_6_6_8.txt.
c [Main] LB-w = 2 (default value).
c [Main] Upper bound is set to 126.
c [Main] Search order: 64 32 16 8 4 2 3 6 5 7 12 10 9 11 14 13 15 24 20 18 17 19 22 21 23 28 26 25 27 30 29 31 48 40 36 34 33 35 38 37 39 44 42 41 43 46 45 47 56 52 50 49 51 54 53 55 60 58 57 59 62 61 63 95 79 71 67 65 66 69 68 70 75 73 72 74 77 76 78 87 83 81 80 82 85 84 86 91 89 88 90 93 92 94 111 103 99 97 96 98 101 100 102 107 105 104 106 109 108 110 119 115 113 112 114 117 116 118 123 121 120 122 125 124 126.
c [w = 8] Start task in PID: 11890.
c [w = 8] Cyclic Antibandwidth problem with w = 8 (3dmesh_6_6_8.txt):
c [w = 8] Initializing CaDiCaL (version 2.1.3).
c [w = 8] Configuring CaDiCaL as --sat (1).
c [w = 8] Encoding starts with w = 8:
c [w = 8] Symmetry breaking highest degree node is applied.
c [w = 8] Encoding duration: 1993 ms.
c [w = 8] Number of clauses: 1720224.
c [w = 8] Number of variables: 236160.
c [w = 8] SAT Solving starts:
c [w = 8] Solving duration: 105 ms.
c [w = 8] Answer:
s [w = 8] SAT (w = 8).
c [w = 8] Solution check = 8.
c [w = 8] The solution is correct.
c [w = 8] Result: 10.
c [Main] Max width SAT is set to 8.
c [Main] Kill lower pid 2.
c [Main] Kill lower pid 4.
c [Main] Kill lower pid 3.
c [Main] Kill lower pid 6.
c [w = 2] Start task in PID: 11892.
c [w = 2] Cyclic Antibandwidth problem with w = 2 (3dmesh_6_6_8.txt):
c [w = 2] Initializing CaDiCaL (version 2.1.3).
c [w = 2] Configuring CaDiCaL as --sat (1).
c [w = 2] Encoding starts with w = 2:
c [w = 2] Symmetry breaking highest degree node is applied.
c [Signal] Signal interruption. Caught signal: SIGTERM (15).
c [w = 3] Start task in PID: 11893.
c [w = 3] Cyclic Antibandwidth problem with w = 3 (3dmesh_6_6_8.txt):
c [w = 3] Initializing CaDiCaL (version 2.1.3).
c [w = 3] Configuring CaDiCaL as --sat (1).
c [w = 3] Encoding starts with w = 3:
c [w = 3] Symmetry breaking highest degree node is applied.
c [w = 3] Encoding duration: 2535 ms.
c [w = 3] Number of clauses: 2580624.
c [w = 3] Number of variables: 184320.
c [w = 3] SAT Solving starts:
c [Signal] Signal interruption. Caught signal: SIGTERM (15).
c [w = 4] Start task in PID: 11891.
c [w = 4] Cyclic Antibandwidth problem with w = 4 (3dmesh_6_6_8.txt):
c [w = 4] Initializing CaDiCaL (version 2.1.3).
c [w = 4] Configuring CaDiCaL as --sat (1).
c [w = 4] Encoding starts with w = 4:
c [w = 4] Symmetry breaking highest degree node is applied.
c [w = 4] Encoding duration: 2298 ms.
c [w = 4] Number of clauses: 2111760.
c [w = 4] Number of variables: 205056.
c [w = 4] SAT Solving starts:
c [w = 4] Solving duration: 84 ms.
c [w = 4] Answer:
s [w = 4] SAT (w = 4).
c [w = 4] Solution check = 4.
c [w = 4] The solution is correct.
c [Signal] Signal interruption. Caught signal: SIGTERM (15).
c [w = 6] Start task in PID: 11894.
c [w = 6] Cyclic Antibandwidth problem with w = 6 (3dmesh_6_6_8.txt):
c [w = 6] Initializing CaDiCaL (version 2.1.3).
c [w = 6] Configuring CaDiCaL as --sat (1).
c [w = 6] Encoding starts with w = 6:
c [w = 6] Symmetry breaking highest degree node is applied.
c [w = 6] Encoding duration: 2062 ms.
c [w = 6] Number of clauses: 1809072.
c [w = 6] Number of variables: 225792.
c [w = 6] SAT Solving starts:
c [w = 6] Solving duration: 358 ms.
c [w = 6] Answer:
s [w = 6] SAT (w = 6).
c [w = 6] Solution check = 6.
c [w = 6] The solution is correct.
c [Signal] Signal interruption. Caught signal: SIGTERM (15).
c [Main] Child pid 6 - 11894 terminated by signal 15.
c [Main] Child pid 4 - 11891 terminated by signal 15.
c [Main] Child pid 3 - 11893 terminated by signal 15.
c [Main] Child pid 2 - 11892 terminated by signal 15.
c [w = 32] Start task in PID: 11888.
c [w = 32] Cyclic Antibandwidth problem with w = 32 (3dmesh_6_6_8.txt):
c [w = 32] Initializing CaDiCaL (version 2.1.3).
c [w = 32] Configuring CaDiCaL as --sat (1).
c [w = 32] Encoding starts with w = 32:
c [w = 32] Symmetry breaking highest degree node is applied.
c [w = 32] Encoding duration: 2019 ms.
c [w = 32] Number of clauses: 1677564.
c [w = 32] Number of variables: 259488.
c [w = 32] SAT Solving starts:
c [w = 32] Solving duration: 2577 ms.
c [w = 32] Answer:
s [w = 32] SAT (w = 32).
c [w = 32] Solution check = 32.
c [w = 32] The solution is correct.
c [w = 32] Result: 10.
c [w = 14] Start task in PID: 11930.
c [w = 14] Cyclic Antibandwidth problem with w = 14 (3dmesh_6_6_8.txt):
c [w = 14] Initializing CaDiCaL (version 2.1.3).
c [w = 14] Configuring CaDiCaL as --sat (1).
c [w = 14] Encoding starts with w = 14:
c [w = 14] Symmetry breaking highest degree node is applied.
c [w = 14] Encoding duration: 1842 ms.
c [w = 14] Number of clauses: 1673676.
c [w = 14] Number of variables: 250848.
c [w = 14] SAT Solving starts:
c [Signal] Signal interruption. Caught signal: SIGTERM (15).
c [w = 9] Start task in PID: 11928.
c [w = 9] Cyclic Antibandwidth problem with w = 9 (3dmesh_6_6_8.txt):
c [w = 9] Initializing CaDiCaL (version 2.1.3).
c [w = 9] Configuring CaDiCaL as --sat (1).
c [w = 9] Encoding starts with w = 9:
c [w = 9] Symmetry breaking highest degree node is applied.
c [w = 9] Encoding duration: 1791 ms.
c [w = 9] Number of clauses: 1699920.
c [w = 9] Number of variables: 239616.
c [w = 9] SAT Solving starts:
c [w = 9] Solving duration: 352 ms.
c [w = 9] Answer:
s [w = 9] SAT (w = 9).
c [w = 9] Solution check = 9.
c [w = 9] The solution is correct.
c [Signal] Signal interruption. Caught signal: SIGTERM (15).
c [w = 11] Start task in PID: 11929.
c [w = 11] Cyclic Antibandwidth problem with w = 11 (3dmesh_6_6_8.txt):
c [w = 11] Initializing CaDiCaL (version 2.1.3).
c [w = 11] Configuring CaDiCaL as --sat (1).
c [w = 11] Encoding starts with w = 11:
c [w = 11] Symmetry breaking highest degree node is applied.
c [w = 11] Encoding duration: 1953 ms.
c [w = 11] Number of clauses: 1689012.
c [w = 11] Number of variables: 246528.
c [w = 11] SAT Solving starts:
c [Signal] Signal interruption. Caught signal: SIGTERM (15).
c [w = 10] Start task in PID: 11927.
c [w = 10] Cyclic Antibandwidth problem with w = 10 (3dmesh_6_6_8.txt):
c [w = 10] Initializing CaDiCaL (version 2.1.3).
c [w = 10] Configuring CaDiCaL as --sat (1).
c [w = 10] Encoding starts with w = 10:
c [w = 10] Symmetry breaking highest degree node is applied.
c [w = 10] Encoding duration: 1785 ms.
c [w = 10] Number of clauses: 1689516.
c [w = 10] Number of variables: 242784.
c [w = 10] SAT Solving starts:
c [Signal] Signal interruption. Caught signal: SIGTERM (15).
c [w = 16] Start task in PID: 11889.
c [w = 16] Cyclic Antibandwidth problem with w = 16 (3dmesh_6_6_8.txt):
c [w = 16] Initializing CaDiCaL (version 2.1.3).
c [w = 16] Configuring CaDiCaL as --sat (1).
c [w = 16] Encoding starts with w = 16:
c [w = 16] Symmetry breaking highest degree node is applied.
c [w = 16] Encoding duration: 1983 ms.
c [w = 16] Number of clauses: 1666152.
c [w = 16] Number of variables: 251712.
c [w = 16] SAT Solving starts:
c [Signal] Signal interruption. Caught signal: SIGTERM (15).
c [Main] Max width SAT is set to 32.
c [Main] Kill lower pid 14.
c [Main] Kill lower pid 11.
c [Main] Kill lower pid 9.
c [Main] Kill lower pid 10.
c [Main] Kill lower pid 16.
c [Main] Kill lower pid 12.
c [w = 12] Start task in PID: 11926.
c [w = 12] Cyclic Antibandwidth problem with w = 12 (3dmesh_6_6_8.txt):
c [w = 12] Initializing CaDiCaL (version 2.1.3).
c [w = 12] Configuring CaDiCaL as --sat (1).
c [w = 12] Encoding starts with w = 12:
c [w = 12] Symmetry breaking highest degree node is applied.
c [w = 12] Encoding duration: 1958 ms.
c [w = 12] Number of clauses: 1673424.
c [w = 12] Number of variables: 246528.
c [w = 12] SAT Solving starts:
c [w = 12] Solving duration: 104 ms.
c [w = 12] Answer:
s [w = 12] SAT (w = 12).
c [w = 12] Solution check = 12.
c [w = 12] The solution is correct.
c [Signal] Signal interruption. Caught signal: SIGTERM (15).
c [Main] Child pid 12 - 11926 terminated by signal 15.
c [Main] Child pid 11 - 11929 terminated by signal 15.
c [Main] Child pid 16 - 11889 terminated by signal 15.
c [Main] Child pid 14 - 11930 terminated by signal 15.
c [Main] Child pid 9 - 11928 terminated by signal 15.
c [Main] Child pid 10 - 11927 terminated by signal 15.
c [w = 48] Start task in PID: 11931.
c [w = 48] Cyclic Antibandwidth problem with w = 48 (3dmesh_6_6_8.txt):
c [w = 48] Initializing CaDiCaL (version 2.1.3).
c [w = 48] Configuring CaDiCaL as --sat (1).
c [w = 48] Encoding starts with w = 48:
c [w = 48] Symmetry breaking highest degree node is applied.
c [w = 48] Encoding duration: 2004 ms.
c [w = 48] Number of clauses: 1689624.
c [w = 48] Number of variables: 262080.
c [w = 48] SAT Solving starts:
c [w = 48] Solving duration: 112 ms.
c [w = 48] Answer:
s [w = 48] SAT (w = 48).
c [w = 48] Solution check = 48.
c [w = 48] The solution is correct.
c [w = 48] Result: 10.
c [w = 34] Start task in PID: 11934.
c [w = 34] Cyclic Antibandwidth problem with w = 34 (3dmesh_6_6_8.txt):
c [w = 34] Initializing CaDiCaL (version 2.1.3).
c [w = 34] Configuring CaDiCaL as --sat (1).
c [w = 34] Encoding starts with w = 34:
c [w = 34] Symmetry breaking highest degree node is applied.
c [w = 34] Encoding duration: 1998 ms.
c [w = 34] Number of clauses: 1693692.
c [w = 34] Number of variables: 264672.
c [w = 34] SAT Solving starts:
c [Signal] Signal interruption. Caught signal: SIGTERM (15).
c [w = 33] Start task in PID: 11935.
c [w = 33] Cyclic Antibandwidth problem with w = 33 (3dmesh_6_6_8.txt):
c [w = 33] Initializing CaDiCaL (version 2.1.3).
c [w = 33] Configuring CaDiCaL as --sat (1).
c [w = 33] Encoding starts with w = 33:
c [w = 33] Symmetry breaking highest degree node is applied.
c [w = 33] Encoding duration: 2003 ms.
c [w = 33] Number of clauses: 1685628.
c [w = 33] Number of variables: 262080.
c [w = 33] SAT Solving starts:
c [Signal] Signal interruption. Caught signal: SIGTERM (15).
c [w = 40] Start task in PID: 11932.
c [w = 40] Cyclic Antibandwidth problem with w = 40 (3dmesh_6_6_8.txt):
c [w = 40] Initializing CaDiCaL (version 2.1.3).
c [w = 40] Configuring CaDiCaL as --sat (1).
c [w = 40] Encoding starts with w = 40:
c [w = 40] Symmetry breaking highest degree node is applied.
c [w = 40] Encoding duration: 2029 ms.
c [w = 40] Number of clauses: 1709712.
c [w = 40] Number of variables: 269568.
c [w = 40] SAT Solving starts:
c [Signal] Signal interruption. Caught signal: SIGTERM (15).
c [w = 35] Start task in PID: 11936.
c [w = 35] Cyclic Antibandwidth problem with w = 35 (3dmesh_6_6_8.txt):
c [w = 35] Initializing CaDiCaL (version 2.1.3).
c [w = 35] Configuring CaDiCaL as --sat (1).
c [w = 35] Encoding starts with w = 35:
c [w = 35] Symmetry breaking highest degree node is applied.
c [w = 35] Encoding duration: 2024 ms.
c [w = 35] Number of clauses: 1701756.
c [w = 35] Number of variables: 267264.
c [w = 35] SAT Solving starts:
c [Signal] Signal interruption. Caught signal: SIGTERM (15).
c [w = 36] Start task in PID: 11933.
c [w = 36] Cyclic Antibandwidth problem with w = 36 (3dmesh_6_6_8.txt):
c [w = 36] Initializing CaDiCaL (version 2.1.3).
c [w = 36] Configuring CaDiCaL as --sat (1).
c [w = 36] Encoding starts with w = 36:
c [w = 36] Symmetry breaking highest degree node is applied.
c [w = 36] Encoding duration: 1987 ms.
c [w = 36] Number of clauses: 1680912.
c [w = 36] Number of variables: 260352.
c [w = 36] SAT Solving starts:
c [Signal] Signal interruption. Caught signal: SIGTERM (15).
c [Main] Max width SAT is set to 48.
c [Main] Kill lower pid 33.
c [Main] Kill lower pid 34.
c [Main] Kill lower pid 40.
c [Main] Kill lower pid 35.
c [Main] Kill lower pid 36.
c [Main] Kill lower pid 38.
c [w = 38] Start task in PID: 11937.
c [w = 38] Cyclic Antibandwidth problem with w = 38 (3dmesh_6_6_8.txt):
c [w = 38] Initializing CaDiCaL (version 2.1.3).
c [w = 38] Configuring CaDiCaL as --sat (1).
c [w = 38] Encoding starts with w = 38:
c [w = 38] Symmetry breaking highest degree node is applied.
c [w = 38] Encoding duration: 1872 ms.
c [w = 38] Number of clauses: 1695312.
c [w = 38] Number of variables: 264960.
c [w = 38] SAT Solving starts:
c [Signal] Signal interruption. Caught signal: SIGTERM (15).
c [Main] Child pid 33 - 11935 terminated by signal 15.
c [Main] Child pid 40 - 11932 terminated by signal 15.
c [Main] Child pid 36 - 11933 terminated by signal 15.
c [Main] Child pid 35 - 11936 terminated by signal 15.
c [Main] Child pid 34 - 11934 terminated by signal 15.
c [Main] Child pid 38 - 11937 terminated by signal 15.
c [w = 54] Start task in PID: 11994.
c [w = 54] Cyclic Antibandwidth problem with w = 54 (3dmesh_6_6_8.txt):
c [w = 54] Initializing CaDiCaL (version 2.1.3).
c [w = 54] Configuring CaDiCaL as --sat (1).
c [w = 54] Encoding starts with w = 54:
c [w = 54] Symmetry breaking highest degree node is applied.
c [w = 54] Encoding duration: 2033 ms.
c [w = 54] Number of clauses: 1722456.
c [w = 54] Number of variables: 272448.
c [w = 54] SAT Solving starts:
c [w = 54] Solving duration: 377 ms.
c [w = 54] Answer:
s [w = 54] SAT (w = 54).
c [w = 54] Solution check = 54.
c [w = 54] The solution is correct.
c [w = 54] Result: 10.
c [w = 53] Start task in PID: 11995.
c [w = 53] Cyclic Antibandwidth problem with w = 53 (3dmesh_6_6_8.txt):
c [w = 53] Initializing CaDiCaL (version 2.1.3).
c [w = 53] Configuring CaDiCaL as --sat (1).
c [w = 53] Encoding starts with w = 53:
c [w = 53] Symmetry breaking highest degree node is applied.
c [w = 53] Encoding duration: 1867 ms.
c [w = 53] Number of clauses: 1716984.
c [w = 53] Number of variables: 270720.
c [w = 53] SAT Solving starts:
c [Signal] Signal interruption. Caught signal: SIGTERM (15).
c [w = 49] Start task in PID: 11992.
c [w = 49] Cyclic Antibandwidth problem with w = 49 (3dmesh_6_6_8.txt):
c [w = 49] Initializing CaDiCaL (version 2.1.3).
c [w = 49] Configuring CaDiCaL as --sat (1).
c [w = 49] Encoding starts with w = 49:
c [w = 49] Symmetry breaking highest degree node is applied.
c [w = 49] Encoding duration: 2007 ms.
c [w = 49] Number of clauses: 1695096.
c [w = 49] Number of variables: 263808.
c [w = 49] SAT Solving starts:
c [Signal] Signal interruption. Caught signal: SIGTERM (15).
c [w = 50] Start task in PID: 11991.
c [w = 50] Cyclic Antibandwidth problem with w = 50 (3dmesh_6_6_8.txt):
c [w = 50] Initializing CaDiCaL (version 2.1.3).
c [w = 50] Configuring CaDiCaL as --sat (1).
c [w = 50] Encoding starts with w = 50:
c [w = 50] Symmetry breaking highest degree node is applied.
c [w = 50] Encoding duration: 2013 ms.
c [w = 50] Number of clauses: 1700568.
c [w = 50] Number of variables: 265536.
c [w = 50] SAT Solving starts:
c [Signal] Signal interruption. Caught signal: SIGTERM (15).
c [w = 52] Start task in PID: 11990.
c [w = 52] Cyclic Antibandwidth problem with w = 52 (3dmesh_6_6_8.txt):
c [w = 52] Initializing CaDiCaL (version 2.1.3).
c [w = 52] Configuring CaDiCaL as --sat (1).
c [w = 52] Encoding starts with w = 52:
c [w = 52] Symmetry breaking highest degree node is applied.
c [w = 52] Encoding duration: 2039 ms.
c [w = 52] Number of clauses: 1711512.
c [w = 52] Number of variables: 268992.
c [w = 52] SAT Solving starts:
c [Signal] Signal interruption. Caught signal: SIGTERM (15).
c [Main] Max width SAT is set to 54.
c [Main] Kill lower pid 53.
c [Main] Kill lower pid 49.
c [Main] Kill lower pid 50.
c [Main] Kill lower pid 52.
c [Main] Kill lower pid 51.
c [w = 51] Start task in PID: 11993.
c [w = 51] Cyclic Antibandwidth problem with w = 51 (3dmesh_6_6_8.txt):
c [w = 51] Initializing CaDiCaL (version 2.1.3).
c [w = 51] Configuring CaDiCaL as --sat (1).
c [w = 51] Encoding starts with w = 51:
c [w = 51] Symmetry breaking highest degree node is applied.
c [w = 51] Encoding duration: 2026 ms.
c [w = 51] Number of clauses: 1706040.
c [w = 51] Number of variables: 267264.
c [w = 51] SAT Solving starts:
c [Signal] Signal interruption. Caught signal: SIGTERM (15).
c [Main] Child pid 52 - 11990 terminated by signal 15.
c [Main] Child pid 50 - 11991 terminated by signal 15.
c [Main] Child pid 51 - 11993 terminated by signal 15.
c [Main] Child pid 49 - 11992 terminated by signal 15.
c [Main] Child pid 53 - 11995 terminated by signal 15.
c [w = 56] Start task in PID: 11989.
c [w = 56] Cyclic Antibandwidth problem with w = 56 (3dmesh_6_6_8.txt):
c [w = 56] Initializing CaDiCaL (version 2.1.3).
c [w = 56] Configuring CaDiCaL as --sat (1).
c [w = 56] Encoding starts with w = 56:
c [w = 56] Symmetry breaking highest degree node is applied.
c [w = 56] Encoding duration: 2070 ms.
c [w = 56] Number of clauses: 1733400.
c [w = 56] Number of variables: 275904.
c [w = 56] SAT Solving starts:
c [w = 56] Solving duration: 49388 ms.
c [w = 56] Answer:
s [w = 56] SAT (w = 56).
c [w = 56] Solution check = 56.
c [w = 56] The solution is correct.
c [w = 56] Result: 10.
c [w = 55] Start task in PID: 11996.
c [w = 55] Cyclic Antibandwidth problem with w = 55 (3dmesh_6_6_8.txt):
c [w = 55] Initializing CaDiCaL (version 2.1.3).
c [w = 55] Configuring CaDiCaL as --sat (1).
c [w = 55] Encoding starts with w = 55:
c [w = 55] Symmetry breaking highest degree node is applied.
c [w = 55] Encoding duration: 1918 ms.
c [w = 55] Number of clauses: 1727928.
c [w = 55] Number of variables: 274176.
c [w = 55] SAT Solving starts:
c [Signal] Signal interruption. Caught signal: SIGTERM (15).
c [Main] Max width SAT is set to 56.
c [Main] Kill lower pid 55.
c [Main] Child pid 55 - 11996 terminated by signal 15.
c [w = 59] Start task in PID: 12001.
c [w = 59] Cyclic Antibandwidth problem with w = 59 (3dmesh_6_6_8.txt):
c [w = 59] Initializing CaDiCaL (version 2.1.3).
c [w = 59] Configuring CaDiCaL as --sat (1).
c [w = 59] Encoding starts with w = 59:
c [w = 59] Symmetry breaking highest degree node is applied.
c [w = 59] Encoding duration: 2007 ms.
c [w = 59] Number of clauses: 1701900.
c [w = 59] Number of variables: 264960.
c [w = 59] SAT Solving starts:
c [w = 59] Solving duration: 51250 ms.
c [w = 59] Answer:
s [w = 59] SAT (w = 59).
c [w = 59] Solution check = 59.
c [w = 59] The solution is correct.
c [w = 59] Result: 10.
c [w = 57] Start task in PID: 12000.
c [w = 57] Cyclic Antibandwidth problem with w = 57 (3dmesh_6_6_8.txt):
c [w = 57] Initializing CaDiCaL (version 2.1.3).
c [w = 57] Configuring CaDiCaL as --sat (1).
c [w = 57] Encoding starts with w = 57:
c [w = 57] Symmetry breaking highest degree node is applied.
c [w = 57] Encoding duration: 2065 ms.
c [w = 57] Number of clauses: 1738872.
c [w = 57] Number of variables: 277632.
c [w = 57] SAT Solving starts:
c [Signal] Signal interruption. Caught signal: SIGTERM (15).
c [Main] Max width SAT is set to 59.
c [Main] Kill lower pid 57.
c [Main] Kill lower pid 58.
c [w = 58] Start task in PID: 11999.
c [w = 58] Cyclic Antibandwidth problem with w = 58 (3dmesh_6_6_8.txt):
c [w = 58] Initializing CaDiCaL (version 2.1.3).
c [w = 58] Configuring CaDiCaL as --sat (1).
c [w = 58] Encoding starts with w = 58:
c [w = 58] Symmetry breaking highest degree node is applied.
c [w = 58] Encoding duration: 1984 ms.
c [w = 58] Number of clauses: 1697292.
c [w = 58] Number of variables: 263520.
c [w = 58] SAT Solving starts:
c [Signal] Signal interruption. Caught signal: SIGTERM (15).
c [Main] Child pid 58 - 11999 terminated by signal 15.
c [Main] Child pid 57 - 12000 terminated by signal 15.
c [w = 64] Start task in PID: 11887.
c [w = 64] Cyclic Antibandwidth problem with w = 64 (3dmesh_6_6_8.txt):
c [w = 64] Initializing CaDiCaL (version 2.1.3).
c [w = 64] Configuring CaDiCaL as --sat (1).
c [w = 64] Encoding starts with w = 64:
c [w = 64] Symmetry breaking highest degree node is applied.
c [w = 64] Encoding duration: 2046 ms.
c [w = 64] Number of clauses: 1724940.
c [w = 64] Number of variables: 272160.
c [w = 64] SAT Solving starts:
c [w = 64] Solving duration: 67867 ms.
c [w = 64] Answer:
s [w = 64] SAT (w = 64).
c [w = 64] Solution check = 64.
c [w = 64] The solution is correct.
c [w = 64] Result: 10.
c [w = 61] Start task in PID: 12094.
c [w = 61] Cyclic Antibandwidth problem with w = 61 (3dmesh_6_6_8.txt):
c [w = 61] Initializing CaDiCaL (version 2.1.3).
c [w = 61] Configuring CaDiCaL as --sat (1).
c [w = 61] Encoding starts with w = 61:
c [w = 61] Symmetry breaking highest degree node is applied.
c [w = 61] Encoding duration: 2015 ms.
c [w = 61] Number of clauses: 1711116.
c [w = 61] Number of variables: 267840.
c [w = 61] SAT Solving starts:
c [Signal] Signal interruption. Caught signal: SIGTERM (15).
c [w = 63] Start task in PID: 12095.
c [w = 63] Cyclic Antibandwidth problem with w = 63 (3dmesh_6_6_8.txt):
c [w = 63] Initializing CaDiCaL (version 2.1.3).
c [w = 63] Configuring CaDiCaL as --sat (1).
c [w = 63] Encoding starts with w = 63:
c [w = 63] Symmetry breaking highest degree node is applied.
c [w = 63] Encoding duration: 2032 ms.
c [w = 63] Number of clauses: 1720332.
c [w = 63] Number of variables: 270720.
c [w = 63] SAT Solving starts:
c [Signal] Signal interruption. Caught signal: SIGTERM (15).
c [w = 62] Start task in PID: 12002.
c [w = 62] Cyclic Antibandwidth problem with w = 62 (3dmesh_6_6_8.txt):
c [w = 62] Initializing CaDiCaL (version 2.1.3).
c [w = 62] Configuring CaDiCaL as --sat (1).
c [w = 62] Encoding starts with w = 62:
c [w = 62] Symmetry breaking highest degree node is applied.
c [w = 62] Encoding duration: 1867 ms.
c [w = 62] Number of clauses: 1715724.
c [w = 62] Number of variables: 269280.
c [w = 62] SAT Solving starts:
c [Signal] Signal interruption. Caught signal: SIGTERM (15).
c [Main] Max width SAT is set to 64.
c [Main] Kill lower pid 63.
c [Main] Kill lower pid 61.
c [Main] Kill lower pid 62.
c [Main] Kill lower pid 60.
c [w = 60] Start task in PID: 11998.
c [w = 60] Cyclic Antibandwidth problem with w = 60 (3dmesh_6_6_8.txt):
c [w = 60] Initializing CaDiCaL (version 2.1.3).
c [w = 60] Configuring CaDiCaL as --sat (1).
c [w = 60] Encoding starts with w = 60:
c [w = 60] Symmetry breaking highest degree node is applied.
c [w = 60] Encoding duration: 2038 ms.
c [w = 60] Number of clauses: 1706508.
c [w = 60] Number of variables: 266400.
c [w = 60] SAT Solving starts:
c [Signal] Signal interruption. Caught signal: SIGTERM (15).
c [Main] Child pid 61 - 12094 terminated by signal 15.
c [Main] Child pid 63 - 12095 terminated by signal 15.
c [Main] Child pid 62 - 12002 terminated by signal 15.
c [Main] Child pid 60 - 11998 terminated by signal 15.
c [w = 71] Start task in PID: 12144.
c [w = 71] Cyclic Antibandwidth problem with w = 71 (3dmesh_6_6_8.txt):
c [w = 71] Initializing CaDiCaL (version 2.1.3).
c [w = 71] Configuring CaDiCaL as --sat (1).
c [w = 71] Encoding starts with w = 71:
c [w = 71] Symmetry breaking highest degree node is applied.
c [w = 71] Encoding duration: 2114 ms.
c [w = 71] Number of clauses: 1757196.
c [w = 71] Number of variables: 282240.
c [w = 71] SAT Solving starts:
c [w = 71] Solving duration: 54938 ms.
c [w = 71] Answer:
s [w = 71] SAT (w = 71).
c [w = 71] Solution check = 71.
c [w = 71] The solution is correct.
c [w = 71] Result: 10.
c [w = 68] Start task in PID: 12200.
c [w = 68] Cyclic Antibandwidth problem with w = 68 (3dmesh_6_6_8.txt):
c [w = 68] Initializing CaDiCaL (version 2.1.3).
c [w = 68] Configuring CaDiCaL as --sat (1).
c [w = 68] Encoding starts with w = 68:
c [w = 68] Symmetry breaking highest degree node is applied.
c [w = 68] Encoding duration: 2073 ms.
c [w = 68] Number of clauses: 1743372.
c [w = 68] Number of variables: 277920.
c [w = 68] SAT Solving starts:
c [Signal] Signal interruption. Caught signal: SIGTERM (15).
c [w = 65] Start task in PID: 12197.
c [w = 65] Cyclic Antibandwidth problem with w = 65 (3dmesh_6_6_8.txt):
c [w = 65] Initializing CaDiCaL (version 2.1.3).
c [w = 65] Configuring CaDiCaL as --sat (1).
c [w = 65] Encoding starts with w = 65:
c [w = 65] Symmetry breaking highest degree node is applied.
c [w = 65] Encoding duration: 2096 ms.
c [w = 65] Number of clauses: 1729548.
c [w = 65] Number of variables: 273600.
c [w = 65] SAT Solving starts:
c [Signal] Signal interruption. Caught signal: SIGTERM (15).
c [w = 67] Start task in PID: 12196.
c [w = 67] Cyclic Antibandwidth problem with w = 67 (3dmesh_6_6_8.txt):
c [w = 67] Initializing CaDiCaL (version 2.1.3).
c [w = 67] Configuring CaDiCaL as --sat (1).
c [w = 67] Encoding starts with w = 67:
c [w = 67] Symmetry breaking highest degree node is applied.
c [w = 67] Encoding duration: 2097 ms.
c [w = 67] Number of clauses: 1738764.
c [w = 67] Number of variables: 276480.
c [w = 67] SAT Solving starts:
c [Signal] Signal interruption. Caught signal: SIGTERM (15).
c [w = 66] Start task in PID: 12198.
c [w = 66] Cyclic Antibandwidth problem with w = 66 (3dmesh_6_6_8.txt):
c [w = 66] Initializing CaDiCaL (version 2.1.3).
c [w = 66] Configuring CaDiCaL as --sat (1).
c [w = 66] Encoding starts with w = 66:
c [w = 66] Symmetry breaking highest degree node is applied.
c [w = 66] Encoding duration: 2070 ms.
c [w = 66] Number of clauses: 1734156.
c [w = 66] Number of variables: 275040.
c [w = 66] SAT Solving starts:
c [Signal] Signal interruption. Caught signal: SIGTERM (15).
c [w = 69] Start task in PID: 12199.
c [w = 69] Cyclic Antibandwidth problem with w = 69 (3dmesh_6_6_8.txt):
c [w = 69] Initializing CaDiCaL (version 2.1.3).
c [w = 69] Configuring CaDiCaL as --sat (1).
c [w = 69] Encoding starts with w = 69:
c [w = 69] Symmetry breaking highest degree node is applied.
c [w = 69] Encoding duration: 1878 ms.
c [w = 69] Number of clauses: 1747980.
c [w = 69] Number of variables: 279360.
c [w = 69] SAT Solving starts:
c [Signal] Signal interruption. Caught signal: SIGTERM (15).
c [Main] Max width SAT is set to 71.
c [Main] Kill lower pid 68.
c [Main] Kill lower pid 65.
c [Main] Kill lower pid 67.
c [Main] Kill lower pid 66.
c [Main] Kill lower pid 69.
c [Main] Child pid 68 - 12200 terminated by signal 15.
c [Main] Child pid 69 - 12199 terminated by signal 15.
c [Main] Child pid 65 - 12197 terminated by signal 15.
c [Main] Child pid 67 - 12196 terminated by signal 15.
c [Main] Child pid 66 - 12198 terminated by signal 15.
c [w = 76] Start task in PID: 12321.
c [w = 76] Cyclic Antibandwidth problem with w = 76 (3dmesh_6_6_8.txt):
c [w = 76] Initializing CaDiCaL (version 2.1.3).
c [w = 76] Configuring CaDiCaL as --sat (1).
c [w = 76] Encoding starts with w = 76:
c [w = 76] Symmetry breaking highest degree node is applied.
c [w = 76] Encoding duration: 2014 ms.
c [w = 76] Number of clauses: 1717920.
c [w = 76] Number of variables: 268416.
c [w = 76] SAT Solving starts:
c [Signal] Signal interruption. Caught signal: SIGTERM (15).
c [w = 74] Start task in PID: 12319.
c [w = 74] Cyclic Antibandwidth problem with w = 74 (3dmesh_6_6_8.txt):
c [w = 74] Initializing CaDiCaL (version 2.1.3).
c [w = 74] Configuring CaDiCaL as --sat (1).
c [w = 74] Encoding starts with w = 74:
c [w = 74] Symmetry breaking highest degree node is applied.
c [w = 74] Encoding duration: 2019 ms.
c [w = 74] Number of clauses: 1710432.
c [w = 74] Number of variables: 266112.
c [w = 74] SAT Solving starts:
c [Signal] Signal interruption. Caught signal: SIGTERM (15).
c [w = 72] Start task in PID: 12318.
c [w = 72] Cyclic Antibandwidth problem with w = 72 (3dmesh_6_6_8.txt):
c [w = 72] Initializing CaDiCaL (version 2.1.3).
c [w = 72] Configuring CaDiCaL as --sat (1).
c [w = 72] Encoding starts with w = 72:
c [w = 72] Symmetry breaking highest degree node is applied.
c [w = 72] Encoding duration: 2013 ms.
c [w = 72] Number of clauses: 1702944.
c [w = 72] Number of variables: 263808.
c [w = 72] SAT Solving starts:
c [Signal] Signal interruption. Caught signal: SIGTERM (15).
c [w = 73] Start task in PID: 12317.
c [w = 73] Cyclic Antibandwidth problem with w = 73 (3dmesh_6_6_8.txt):
c [w = 73] Initializing CaDiCaL (version 2.1.3).
c [w = 73] Configuring CaDiCaL as --sat (1).
c [w = 73] Encoding starts with w = 73:
c [w = 73] Symmetry breaking highest degree node is applied.
c [w = 73] Encoding duration: 2004 ms.
c [w = 73] Number of clauses: 1706688.
c [w = 73] Number of variables: 264960.
c [w = 73] SAT Solving starts:
c [Signal] Signal interruption. Caught signal: SIGTERM (15).
c [w = 75] Start task in PID: 12316.
c [w = 75] Cyclic Antibandwidth problem with w = 75 (3dmesh_6_6_8.txt):
c [w = 75] Initializing CaDiCaL (version 2.1.3).
c [w = 75] Configuring CaDiCaL as --sat (1).
c [w = 75] Encoding starts with w = 75:
c [w = 75] Symmetry breaking highest degree node is applied.
c [w = 75] Encoding duration: 1792 ms.
c [w = 75] Number of clauses: 1714176.
c [w = 75] Number of variables: 267264.
c [w = 75] SAT Solving starts:
c [Signal] Signal interruption. Caught signal: SIGTERM (15).
c [w = 79] Start task in PID: 12143.
c [w = 79] Cyclic Antibandwidth problem with w = 79 (3dmesh_6_6_8.txt):
c [w = 79] Initializing CaDiCaL (version 2.1.3).
c [w = 79] Configuring CaDiCaL as --sat (1).
c [w = 79] Encoding starts with w = 79:
c [w = 79] Symmetry breaking highest degree node is applied.
c [w = 79] Encoding duration: 1928 ms.
c [w = 79] Number of clauses: 1729152.
c [w = 79] Number of variables: 271872.
c [w = 79] SAT Solving starts:
c [Signal] Signal interruption. Caught signal: SIGTERM (15).
c [w = 95] Start task in PID: 12142.
c [w = 95] Cyclic Antibandwidth problem with w = 95 (3dmesh_6_6_8.txt):
c [w = 95] Initializing CaDiCaL (version 2.1.3).
c [w = 95] Configuring CaDiCaL as --sat (1).
c [w = 95] Encoding starts with w = 95:
c [w = 95] Symmetry breaking highest degree node is applied.
c [w = 95] Encoding duration: 2176 ms.
c [w = 95] Number of clauses: 1789056.
c [w = 95] Number of variables: 290304.
c [w = 95] SAT Solving starts:
c [Signal] Signal interruption. Caught signal: SIGTERM (15).
c [Main] Lim pid ends with result: 254.
c [Main] All children have completed.
r [Main] 
r [Main] Final results: 
r [Main] Max width SAT:  	71.
r [Main] Min width UNSAT:	-.
r [Main] Total real time: 151254 ms.
r [Main] Total memory consumed: 4117.7 MB.
r [Main] 
c [w = 77] Start task in PID: 12320.
c [w = 77] Cyclic Antibandwidth problem with w = 77 (3dmesh_6_6_8.txt):
c [w = 77] Initializing CaDiCaL (version 2.1.3).
c [w = 77] Configuring CaDiCaL as --sat (1).
c [w = 77] Encoding starts with w = 77:
c [w = 77] Symmetry breaking highest degree node is applied.
c [w = 77] Encoding duration: 1941 ms.
c [w = 77] Number of clauses: 1721664.
c [w = 77] Number of variables: 269568.
c [w = 77] SAT Solving starts:
c [Signal] Signal interruption. Caught signal: SIGTERM (15).
