c [Version] Cyclic Bandwidth Encoder version 1.0.0.
c [Param] Real time limit is set to 150.
c [Param] Memory limit is set to 30000.
c [Param] Worker count is set to 4.
c [Main] Encoding and solving for graph: 3dmesh_2_2_500.txt.
c [Main] Search strategy: Binary search from lower bound.
c [Main] No predefined lower bound is found for 3dmesh_2_2_500.txt.
c [Main] LB-w = 2 (default value).
c [Main] Upper bound is set to 999.
c [Main] Search order: 500 250 125 63 32 16 8 4 2 3 6 5 7 12 10 9 11 14 13 15 24 20 18 17 19 22 21 23 28 26 25 27 30 29 31 47 39 35 33 34 37 36 38 43 41 40 42 45 44 46 55 51 49 48 50 53 52 54 59 57 56 58 61 60 62 94 78 70 66 64 65 68 67 69 74 72 71 73 76 75 77 86 82 80 79 81 84 83 85 90 88 87 89 92 91 93 109 101 97 95 96 99 98 100 105 103 102 104 107 106 108 117 113 111 110 112 115 114 116 121 119 118 120 123 122 124 187 156 140 132 128 126 127 130 129 131 136 134 133 135 138 137 139 148 144 142 141 143 146 145 147 152 150 149 151 154 153 155 171 163 159 157 158 161 160 162 167 165 164 166 169 168 170 179 175 173 172 174 177 176 178 183 181 180 182 185 184 186 218 202 194 190 188 189 192 191 193 198 196 195 197 200 199 201 210 206 204 203 205 208 207 209 214 212 211 213 216 215 217 234 226 222 220 219 221 224 223 225 230 228 227 229 232 231 233 242 238 236 235 237 240 239 241 246 244 243 245 248 247 249 375 312 281 265 257 253 251 252 255 254 256 261 259 258 260 263 262 264 273 269 267 266 268 271 270 272 277 275 274 276 279 278 280 296 288 284 282 283 286 285 287 292 290 289 291 294 293 295 304 300 298 297 299 302 301 303 308 306 305 307 310 309 311 343 327 319 315 313 314 317 316 318 323 321 320 322 325 324 326 335 331 329 328 330 333 332 334 339 337 336 338 341 340 342 359 351 347 345 344 346 349 348 350 355 353 352 354 357 356 358 367 363 361 360 362 365 364 366 371 369 368 370 373 372 374 437 406 390 382 378 376 377 380 379 381 386 384 383 385 388 387 389 398 394 392 391 393 396 395 397 402 400 399 401 404 403 405 421 413 409 407 408 411 410 412 417 415 414 416 419 418 420 429 425 423 422 424 427 426 428 433 431 430 432 435 434 436 468 452 444 440 438 439 442 441 443 448 446 445 447 450 449 451 460 456 454 453 455 458 457 459 464 462 461 463 466 465 467 484 476 472 470 469 471 474 473 475 480 478 477 479 482 481 483 492 488 486 485 487 490 489 491 496 494 493 495 498 497 499 750 625 562 531 515 507 503 501 502 505 504 506 511 509 508 510 513 512 514 523 519 517 516 518 521 520 522 527 525 524 526 529 528 530 546 538 534 532 533 536 535 537 542 540 539 541 544 543 545 554 550 548 547 549 552 551 553 558 556 555 557 560 559 561 593 577 569 565 563 564 567 566 568 573 571 570 572 575 574 576 585 581 579 578 580 583 582 584 589 587 586 588 591 590 592 609 601 597 595 594 596 599 598 600 605 603 602 604 607 606 608 617 613 611 610 612 615 614 616 621 619 618 620 623 622 624 687 656 640 632 628 626 627 630 629 631 636 634 633 635 638 637 639 648 644 642 641 643 646 645 647 652 650 649 651 654 653 655 671 663 659 657 658 661 660 662 667 665 664 666 669 668 670 679 675 673 672 674 677 676 678 683 681 680 682 685 684 686 718 702 694 690 688 689 692 691 693 698 696 695 697 700 699 701 710 706 704 703 705 708 707 709 714 712 711 713 716 715 717 734 726 722 720 719 721 724 723 725 730 728 727 729 732 731 733 742 738 736 735 737 740 739 741 746 744 743 745 748 747 749 875 812 781 765 757 753 751 752 755 754 756 761 759 758 760 763 762 764 773 769 767 766 768 771 770 772 777 775 774 776 779 778 780 796 788 784 782 783 786 785 787 792 790 789 791 794 793 795 804 800 798 797 799 802 801 803 808 806 805 807 810 809 811 843 827 819 815 813 814 817 816 818 823 821 820 822 825 824 826 835 831 829 828 830 833 832 834 839 837 836 838 841 840 842 859 851 847 845 844 846 849 848 850 855 853 852 854 857 856 858 867 863 861 860 862 865 864 866 871 869 868 870 873 872 874 937 906 890 882 878 876 877 880 879 881 886 884 883 885 888 887 889 898 894 892 891 893 896 895 897 902 900 899 901 904 903 905 921 913 909 907 908 911 910 912 917 915 914 916 919 918 920 929 925 923 922 924 927 926 928 933 931 930 932 935 934 936 968 952 944 940 938 939 942 941 943 948 946 945 947 950 949 951 960 956 954 953 955 958 957 959 964 962 961 963 966 965 967 984 976 972 970 969 971 974 973 975 980 978 977 979 982 981 983 992 988 986 985 987 990 989 991 996 994 993 995 998 997 999.
c [w = 125] Start task in PID: 7110.
c [w = 125] Cyclic Antibandwidth problem with w = 125 (3dmesh_2_2_500.txt):
c [w = 125] Initializing CaDiCaL (version 2.1.3).
c [w = 125] Configuring CaDiCaL as --sat (1).
c [w = 125] Encoding starts with w = 125:
c [w = 125] Symmetry breaking highest degree node is applied.
c [Signal] Signal interruption. Caught signal: SIGTERM (15).
c [Main] Lim pid ends with result: 255.
c [Main] All children have completed.
r [Main] 
r [Main] Final results: 
r [Main] Max width SAT:  	-.
r [Main] Min width UNSAT:	-.
r [Main] Total real time: 26540 ms.
r [Main] Total memory consumed: 30483.5 MB.
r [Main] 
c [w = 250] Start task in PID: 7109.
c [w = 250] Cyclic Antibandwidth problem with w = 250 (3dmesh_2_2_500.txt):
c [w = 250] Initializing CaDiCaL (version 2.1.3).
c [w = 250] Configuring CaDiCaL as --sat (1).
c [w = 250] Encoding starts with w = 250:
c [w = 250] Symmetry breaking highest degree node is applied.
c [Signal] Signal interruption. Caught signal: SIGTERM (15).
c [w = 63] Start task in PID: 7111.
c [w = 63] Cyclic Antibandwidth problem with w = 63 (3dmesh_2_2_500.txt):
c [w = 63] Initializing CaDiCaL (version 2.1.3).
c [w = 63] Configuring CaDiCaL as --sat (1).
c [w = 63] Encoding starts with w = 63:
c [w = 63] Symmetry breaking highest degree node is applied.
c [Signal] Signal interruption. Caught signal: SIGTERM (15).
c [w = 500] Start task in PID: 7108.
c [w = 500] Cyclic Antibandwidth problem with w = 500 (3dmesh_2_2_500.txt):
c [w = 500] Initializing CaDiCaL (version 2.1.3).
c [w = 500] Configuring CaDiCaL as --sat (1).
c [w = 500] Encoding starts with w = 500:
c [w = 500] Symmetry breaking highest degree node is applied.
c [Signal] Signal interruption. Caught signal: SIGTERM (15).
