c [Version] Cyclic Bandwidth Encoder version 1.0.0.
c [Param] Real time limit is set to 150.
c [Param] Memory limit is set to 30000.
c [Param] Worker count is set to 8.
c [Main] Encoding and solving for graph: cbt_790.txt.
c [Main] Search strategy: Binary search from upper bound.
c [Main] No predefined lower bound is found for cbt_790.txt.
c [Main] LB-w = 2 (default value).
c [Main] No predefined upper bound is found for cbt_790.txt.
c [Main] UB-w = 395 (default value calculated as n/2).
c [Main] Search order: 198 297 346 371 383 389 392 394 395 393 390 391 386 387 388 384 385 377 380 381 382 378 379 374 375 376 372 373 358 364 367 369 370 368 365 366 361 362 363 359 360 352 355 356 357 353 354 349 350 351 347 348 321 333 339 342 344 345 343 340 341 336 337 338 334 335 327 330 331 332 328 329 324 325 326 322 323 309 315 318 319 320 316 317 312 313 314 310 311 303 306 307 308 304 305 300 301 302 298 299 247 272 284 290 293 295 296 294 291 292 287 288 289 285 286 278 281 282 283 279 280 275 276 277 273 274 259 265 268 270 271 269 266 267 262 263 264 260 261 253 256 257 258 254 255 250 251 252 248 249 222 234 240 243 245 246 244 241 242 237 238 239 235 236 228 231 232 233 229 230 225 226 227 223 224 210 216 219 220 221 217 218 213 214 215 211 212 204 207 208 209 205 206 201 202 203 199 200 99 148 173 185 191 194 196 197 195 192 193 188 189 190 186 187 179 182 183 184 180 181 176 177 178 174 175 160 166 169 171 172 170 167 168 163 164 165 161 162 154 157 158 159 155 156 151 152 153 149 150 123 135 141 144 146 147 145 142 143 138 139 140 136 137 129 132 133 134 130 131 126 127 128 124 125 111 117 120 121 122 118 119 114 115 116 112 113 105 108 109 110 106 107 102 103 104 100 101 50 74 86 92 95 97 98 96 93 94 89 90 91 87 88 80 83 84 85 81 82 77 78 79 75 76 62 68 71 72 73 69 70 65 66 67 63 64 56 59 60 61 57 58 53 54 55 51 52 25 37 43 46 48 49 47 44 45 40 41 42 38 39 31 34 35 36 32 33 28 29 30 26 27 13 19 22 23 24 20 21 16 17 18 14 15 7 10 11 12 8 9 4 5 6 2 3.
c [w = 198] Start task in PID: 175028.
c [w = 198] Cyclic Antibandwidth problem with w = 198 (cbt_790.txt):
c [w = 198] Initializing CaDiCaL (version 2.1.3).
c [w = 198] Configuring CaDiCaL as --sat (1).
c [w = 198] Encoding starts with w = 198:
c [w = 198] Symmetry breaking highest degree node is applied.
c [w = 198] Encoding duration: 6298 ms.
c [w = 198] Number of clauses: 8990607.
c [w = 198] Number of variables: 1951300.
c [w = 198] SAT Solving starts:
c [w = 198] Solving duration: 1939 ms.
c [w = 198] Answer:
s [w = 198] SAT (w = 198).
c [w = 198] Solution check = 198.
c [w = 198] The solution is correct.
c [w = 198] Result: 10.
c [Main] Max width SAT is set to 198.
c [w = 395] Start task in PID: 175042.
c [w = 395] Cyclic Antibandwidth problem with w = 395 (cbt_790.txt):
c [w = 395] Initializing CaDiCaL (version 2.1.3).
c [w = 395] Configuring CaDiCaL as --sat (1).
c [w = 395] Encoding starts with w = 395:
c [w = 395] Symmetry breaking highest degree node is applied.
c [w = 395] Encoding duration: 5880 ms.
c [w = 395] Number of clauses: 9154921.
c [w = 395] Number of variables: 1954460.
c [w = 395] SAT Solving starts:
c [w = 395] Solving duration: 13 ms.
c [w = 395] Answer:
s [w = 395] UNSAT (w = 395).
c [w = 395] Result: 20.
c [Main] Min width UNSAT is set to 395
c [w = 394] Start task in PID: 175035.
c [w = 394] Cyclic Antibandwidth problem with w = 394 (cbt_790.txt):
c [w = 394] Initializing CaDiCaL (version 2.1.3).
c [w = 394] Configuring CaDiCaL as --sat (1).
c [w = 394] Encoding starts with w = 394:
c [w = 394] Symmetry breaking highest degree node is applied.
c [w = 394] Encoding duration: 7203 ms.
c [w = 394] Number of clauses: 10076064.
c [w = 394] Number of variables: 2261770.
c [w = 394] SAT Solving starts:
c [w = 394] Solving duration: 115140 ms.
c [w = 394] Answer:
s [w = 394] UNSAT (w = 394).
c [w = 394] Result: 20.
c [Main] Min width UNSAT is set to 394
c [w = 390] Start task in PID: 175062.
c [w = 390] Cyclic Antibandwidth problem with w = 390 (cbt_790.txt):
c [w = 390] Initializing CaDiCaL (version 2.1.3).
c [w = 390] Configuring CaDiCaL as --sat (1).
c [w = 390] Encoding starts with w = 390:
c [w = 390] Symmetry breaking highest degree node is applied.
c [w = 390] Encoding duration: 6719 ms.
c [w = 390] Number of clauses: 10044464.
c [w = 390] Number of variables: 2252290.
c [w = 390] SAT Solving starts:
c [Signal] Signal interruption. Caught signal: SIGTERM (15).
c [w = 393] Start task in PID: 175043.
c [w = 393] Cyclic Antibandwidth problem with w = 393 (cbt_790.txt):
c [w = 393] Initializing CaDiCaL (version 2.1.3).
c [w = 393] Configuring CaDiCaL as --sat (1).
c [w = 393] Encoding starts with w = 393:
c [w = 393] Symmetry breaking highest degree node is applied.
c [w = 393] Encoding duration: 7243 ms.
c [w = 393] Number of clauses: 10068164.
c [w = 393] Number of variables: 2259400.
c [w = 393] SAT Solving starts:
c [Signal] Signal interruption. Caught signal: SIGTERM (15).
c [w = 392] Start task in PID: 175034.
c [w = 392] Cyclic Antibandwidth problem with w = 392 (cbt_790.txt):
c [w = 392] Initializing CaDiCaL (version 2.1.3).
c [w = 392] Configuring CaDiCaL as --sat (1).
c [w = 392] Encoding starts with w = 392:
c [w = 392] Symmetry breaking highest degree node is applied.
c [w = 392] Encoding duration: 7164 ms.
c [w = 392] Number of clauses: 10060264.
c [w = 392] Number of variables: 2257030.
c [w = 392] SAT Solving starts:
c [Signal] Signal interruption. Caught signal: SIGTERM (15).
c [w = 389] Start task in PID: 175033.
c [w = 389] Cyclic Antibandwidth problem with w = 389 (cbt_790.txt):
c [w = 389] Initializing CaDiCaL (version 2.1.3).
c [w = 389] Configuring CaDiCaL as --sat (1).
c [w = 389] Encoding starts with w = 389:
c [w = 389] Symmetry breaking highest degree node is applied.
c [w = 389] Encoding duration: 7168 ms.
c [w = 389] Number of clauses: 10036564.
c [w = 389] Number of variables: 2249920.
c [w = 389] SAT Solving starts:
c [Signal] Signal interruption. Caught signal: SIGTERM (15).
c [w = 383] Start task in PID: 175032.
c [w = 383] Cyclic Antibandwidth problem with w = 383 (cbt_790.txt):
c [w = 383] Initializing CaDiCaL (version 2.1.3).
c [w = 383] Configuring CaDiCaL as --sat (1).
c [w = 383] Encoding starts with w = 383:
c [w = 383] Symmetry breaking highest degree node is applied.
c [w = 383] Encoding duration: 7051 ms.
c [w = 383] Number of clauses: 9989164.
c [w = 383] Number of variables: 2235700.
c [w = 383] SAT Solving starts:
c [Signal] Signal interruption. Caught signal: SIGTERM (15).
c [w = 371] Start task in PID: 175031.
c [w = 371] Cyclic Antibandwidth problem with w = 371 (cbt_790.txt):
c [w = 371] Initializing CaDiCaL (version 2.1.3).
c [w = 371] Configuring CaDiCaL as --sat (1).
c [w = 371] Encoding starts with w = 371:
c [w = 371] Symmetry breaking highest degree node is applied.
c [w = 371] Encoding duration: 7002 ms.
c [w = 371] Number of clauses: 9894364.
c [w = 371] Number of variables: 2207260.
c [w = 371] SAT Solving starts:
c [Signal] Signal interruption. Caught signal: SIGTERM (15).
c [w = 297] Start task in PID: 175029.
c [w = 297] Cyclic Antibandwidth problem with w = 297 (cbt_790.txt):
c [w = 297] Initializing CaDiCaL (version 2.1.3).
c [w = 297] Configuring CaDiCaL as --sat (1).
c [w = 297] Encoding starts with w = 297:
c [w = 297] Symmetry breaking highest degree node is applied.
c [w = 297] Encoding duration: 6567 ms.
c [w = 297] Number of clauses: 9309764.
c [w = 297] Number of variables: 2031880.
c [w = 297] SAT Solving starts:
c [Signal] Signal interruption. Caught signal: SIGTERM (15).
c [Main] Lim pid ends with result: 254.
c [Main] All children have completed.
r [Main] 
r [Main] Final results: 
r [Main] Max width SAT:  	198.
r [Main] Min width UNSAT:	394.
r [Main] Total real time: 151026 ms.
r [Main] Total memory consumed: 21700.2 MB.
r [Main] 
c [w = 346] Start task in PID: 175030.
c [w = 346] Cyclic Antibandwidth problem with w = 346 (cbt_790.txt):
c [w = 346] Initializing CaDiCaL (version 2.1.3).
c [w = 346] Configuring CaDiCaL as --sat (1).
c [w = 346] Encoding starts with w = 346:
c [w = 346] Symmetry breaking highest degree node is applied.
c [w = 346] Encoding duration: 6843 ms.
c [w = 346] Number of clauses: 9696864.
c [w = 346] Number of variables: 2148010.
c [w = 346] SAT Solving starts:
c [Signal] Signal interruption. Caught signal: SIGTERM (15).
