c [Version] Cyclic Bandwidth Encoder version 1.0.0.
c [Param] Real time limit is set to 150.
c [Param] Memory limit is set to 30000.
c [Param] Worker count is set to 8.
c [Main] Encoding and solving for graph: R-dwt__503.mtx.rnd.
c [Main] Search strategy: Binary search using BFS.
c [Main] Lower bound is set to 23.
c [Main] Upper bound is set to 71.
c [Main] Search order: 47 34 59 28 40 53 65 25 31 37 43 50 56 62 68 23 26 29 32 35 38 41 45 48 51 54 57 60 63 66 70 24 27 30 33 36 39 42 44 46 49 52 55 58 61 64 67 69 71.
c [w = 25] Start task in PID: 7006.
c [w = 25] Cyclic Antibandwidth problem with w = 25 (R-dwt__503.mtx.rnd):
c [w = 25] Initializing CaDiCaL (version 2.1.3).
c [w = 25] Configuring CaDiCaL as --sat (1).
c [w = 25] Encoding starts with w = 25:
c [w = 25] Symmetry breaking highest degree node is applied.
c [w = 25] Encoding duration: 5003 ms.
c [w = 25] Number of clauses: 8041744.
c [w = 25] Number of variables: 781662.
c [w = 25] SAT Solving starts:
c [w = 25] Solving duration: 976 ms.
c [w = 25] Answer:
s [w = 25] SAT (w = 25).
c [w = 25] Solution check = 25.
c [w = 25] The solution is correct.
c [w = 25] Result: 10.
c [w = 28] Start task in PID: 7002.
c [w = 28] Cyclic Antibandwidth problem with w = 28 (R-dwt__503.mtx.rnd):
c [w = 28] Initializing CaDiCaL (version 2.1.3).
c [w = 28] Configuring CaDiCaL as --sat (1).
c [w = 28] Encoding starts with w = 28:
c [w = 28] Symmetry breaking highest degree node is applied.
c [w = 28] Encoding duration: 4903 ms.
c [w = 28] Number of clauses: 8019823.
c [w = 28] Number of variables: 775626.
c [w = 28] SAT Solving starts:
c [w = 28] Solving duration: 1098 ms.
c [w = 28] Answer:
s [w = 28] SAT (w = 28).
c [w = 28] Solution check = 28.
c [w = 28] The solution is correct.
c [w = 28] Result: 10.
c [Main] Max width SAT is set to 25.
c [Main] Max width SAT is set to 28.
c [w = 34] Start task in PID: 7000.
c [w = 34] Cyclic Antibandwidth problem with w = 34 (R-dwt__503.mtx.rnd):
c [w = 34] Initializing CaDiCaL (version 2.1.3).
c [w = 34] Configuring CaDiCaL as --sat (1).
c [w = 34] Encoding starts with w = 34:
c [w = 34] Symmetry breaking highest degree node is applied.
c [w = 34] Encoding duration: 4945 ms.
c [w = 34] Number of clauses: 8044681.
c [w = 34] Number of variables: 783171.
c [w = 34] SAT Solving starts:
c [w = 34] Solving duration: 2495 ms.
c [w = 34] Answer:
s [w = 34] SAT (w = 34).
c [w = 34] Solution check = 34.
c [w = 34] The solution is correct.
c [w = 34] Result: 10.
c [Main] Max width SAT is set to 34.
c [Main] Kill lower pid 31.
c [w = 31] Start task in PID: 7008.
c [w = 31] Cyclic Antibandwidth problem with w = 31 (R-dwt__503.mtx.rnd):
c [w = 31] Initializing CaDiCaL (version 2.1.3).
c [w = 31] Configuring CaDiCaL as --sat (1).
c [w = 31] Encoding starts with w = 31:
c [w = 31] Symmetry breaking highest degree node is applied.
c [Signal] Signal interruption. Caught signal: SIGTERM (15).
c [Main] Child pid 31 - 7008 terminated by signal 15.
c [w = 47] Start task in PID: 6999.
c [w = 47] Cyclic Antibandwidth problem with w = 47 (R-dwt__503.mtx.rnd):
c [w = 47] Initializing CaDiCaL (version 2.1.3).
c [w = 47] Configuring CaDiCaL as --sat (1).
c [w = 47] Encoding starts with w = 47:
c [w = 47] Symmetry breaking highest degree node is applied.
c [w = 47] Encoding duration: 4931 ms.
c [w = 47] Number of clauses: 8085873.
c [w = 47] Number of variables: 792728.
c [w = 47] SAT Solving starts:
c [w = 47] Solving duration: 7431 ms.
c [w = 47] Answer:
s [w = 47] SAT (w = 47).
c [w = 47] Solution check = 47.
c [w = 47] The solution is correct.
c [w = 47] Result: 10.
c [Main] Max width SAT is set to 47.
c [Main] Kill lower pid 43.
c [Main] Kill lower pid 37.
c [Main] Kill lower pid 40.
c [w = 40] Start task in PID: 7003.
c [w = 40] Cyclic Antibandwidth problem with w = 40 (R-dwt__503.mtx.rnd):
c [w = 40] Initializing CaDiCaL (version 2.1.3).
c [w = 40] Configuring CaDiCaL as --sat (1).
c [w = 40] Encoding starts with w = 40:
c [w = 40] Symmetry breaking highest degree node is applied.
c [w = 40] Encoding duration: 4939 ms.
c [w = 40] Number of clauses: 8073828.
c [w = 40] Number of variables: 791219.
c [w = 40] SAT Solving starts:
c [Signal] Signal interruption. Caught signal: SIGTERM (15).
c [w = 37] Start task in PID: 7009.
c [w = 37] Cyclic Antibandwidth problem with w = 37 (R-dwt__503.mtx.rnd):
c [w = 37] Initializing CaDiCaL (version 2.1.3).
c [w = 37] Configuring CaDiCaL as --sat (1).
c [w = 37] Encoding starts with w = 37:
c [w = 37] Symmetry breaking highest degree node is applied.
c [w = 37] Encoding duration: 5020 ms.
c [w = 37] Number of clauses: 8063530.
c [w = 37] Number of variables: 788704.
c [w = 37] SAT Solving starts:
c [Signal] Signal interruption. Caught signal: SIGTERM (15).
c [w = 43] Start task in PID: 7010.
c [w = 43] Cyclic Antibandwidth problem with w = 43 (R-dwt__503.mtx.rnd):
c [w = 43] Initializing CaDiCaL (version 2.1.3).
c [w = 43] Configuring CaDiCaL as --sat (1).
c [w = 43] Encoding starts with w = 43:
c [w = 43] Symmetry breaking highest degree node is applied.
c [Signal] Signal interruption. Caught signal: SIGTERM (15).
c [Main] Child pid 43 - 7010 terminated by signal 15.
c [Main] Child pid 40 - 7003 terminated by signal 15.
c [Main] Child pid 37 - 7009 terminated by signal 15.
c [w = 48] Start task in PID: 7015.
c [w = 48] Cyclic Antibandwidth problem with w = 48 (R-dwt__503.mtx.rnd):
c [w = 48] Initializing CaDiCaL (version 2.1.3).
c [w = 48] Configuring CaDiCaL as --sat (1).
c [w = 48] Encoding starts with w = 48:
c [w = 48] Symmetry breaking highest degree node is applied.
c [w = 48] Encoding duration: 4770 ms.
c [w = 48] Number of clauses: 8102975.
c [w = 48] Number of variables: 798261.
c [w = 48] SAT Solving starts:
c [w = 48] Solving duration: 6859 ms.
c [w = 48] Answer:
s [w = 48] SAT (w = 48).
c [w = 48] Solution check = 48.
c [w = 48] The solution is correct.
c [w = 48] Result: 10.
c [Main] Max width SAT is set to 48.
e [Pid] Unable to open /proc/7015/status
c [w = 51] Start task in PID: 7018.
c [w = 51] Cyclic Antibandwidth problem with w = 51 (R-dwt__503.mtx.rnd):
c [w = 51] Initializing CaDiCaL (version 2.1.3).
c [w = 51] Configuring CaDiCaL as --sat (1).
c [w = 51] Encoding starts with w = 51:
c [w = 51] Symmetry breaking highest degree node is applied.
c [w = 51] Encoding duration: 4721 ms.
c [w = 51] Number of clauses: 8084602.
c [w = 51] Number of variables: 790716.
c [w = 51] SAT Solving starts:
c [w = 51] Solving duration: 7480 ms.
c [w = 51] Answer:
s [w = 51] SAT (w = 51).
c [w = 51] Solution check = 51.
c [w = 51] The solution is correct.
c [w = 51] Result: 10.
c [Main] Max width SAT is set to 51.
c [Main] Kill lower pid 50.
c [w = 50] Start task in PID: 7011.
c [w = 50] Cyclic Antibandwidth problem with w = 50 (R-dwt__503.mtx.rnd):
c [w = 50] Initializing CaDiCaL (version 2.1.3).
c [w = 50] Configuring CaDiCaL as --sat (1).
c [w = 50] Encoding starts with w = 50:
c [w = 50] Symmetry breaking highest degree node is applied.
c [w = 50] Encoding duration: 4956 ms.
c [w = 50] Number of clauses: 8137179.
c [w = 50] Number of variables: 809327.
c [w = 50] SAT Solving starts:
c [Signal] Signal interruption. Caught signal: SIGTERM (15).
c [Main] Child pid 50 - 7011 terminated by signal 15.
c [w = 53] Start task in PID: 7004.
c [w = 53] Cyclic Antibandwidth problem with w = 53 (R-dwt__503.mtx.rnd):
c [w = 53] Initializing CaDiCaL (version 2.1.3).
c [w = 53] Configuring CaDiCaL as --sat (1).
c [w = 53] Encoding starts with w = 53:
c [w = 53] Symmetry breaking highest degree node is applied.
c [w = 53] Encoding duration: 4971 ms.
c [w = 53] Number of clauses: 8115788.
c [w = 53] Number of variables: 800776.
c [w = 53] SAT Solving starts:
c [w = 53] Solving duration: 40289 ms.
c [w = 53] Answer:
s [w = 53] SAT (w = 53).
c [w = 53] Solution check = 53.
c [w = 53] The solution is correct.
c [w = 53] Result: 10.
c [Main] Max width SAT is set to 53.
c [w = 54] Start task in PID: 7020.
c [w = 54] Cyclic Antibandwidth problem with w = 54 (R-dwt__503.mtx.rnd):
c [w = 54] Initializing CaDiCaL (version 2.1.3).
c [w = 54] Configuring CaDiCaL as --sat (1).
c [w = 54] Encoding starts with w = 54:
c [w = 54] Symmetry breaking highest degree node is applied.
c [w = 54] Encoding duration: 4907 ms.
c [w = 54] Number of clauses: 8131381.
c [w = 54] Number of variables: 805806.
c [w = 54] SAT Solving starts:
c [Signal] Signal interruption. Caught signal: SIGTERM (15).
c [w = 68] Start task in PID: 7014.
c [w = 68] Cyclic Antibandwidth problem with w = 68 (R-dwt__503.mtx.rnd):
c [w = 68] Initializing CaDiCaL (version 2.1.3).
c [w = 68] Configuring CaDiCaL as --sat (1).
c [w = 68] Encoding starts with w = 68:
c [w = 68] Symmetry breaking highest degree node is applied.
c [w = 68] Encoding duration: 5100 ms.
c [w = 68] Number of clauses: 8160528.
c [w = 68] Number of variables: 810836.
c [w = 68] SAT Solving starts:
c [Signal] Signal interruption. Caught signal: SIGTERM (15).
c [w = 62] Start task in PID: 7013.
c [w = 62] Cyclic Antibandwidth problem with w = 62 (R-dwt__503.mtx.rnd):
c [w = 62] Initializing CaDiCaL (version 2.1.3).
c [w = 62] Configuring CaDiCaL as --sat (1).
c [w = 62] Encoding starts with w = 62:
c [w = 62] Symmetry breaking highest degree node is applied.
c [w = 62] Encoding duration: 5147 ms.
c [w = 62] Number of clauses: 8170350.
c [w = 62] Number of variables: 816369.
c [w = 62] SAT Solving starts:
c [Signal] Signal interruption. Caught signal: SIGTERM (15).
c [w = 56] Start task in PID: 7012.
c [w = 56] Cyclic Antibandwidth problem with w = 56 (R-dwt__503.mtx.rnd):
c [w = 56] Initializing CaDiCaL (version 2.1.3).
c [w = 56] Configuring CaDiCaL as --sat (1).
c [w = 56] Encoding starts with w = 56:
c [w = 56] Symmetry breaking highest degree node is applied.
c [w = 56] Encoding duration: 4880 ms.
c [w = 56] Number of clauses: 8085846.
c [w = 56] Number of variables: 789207.
c [w = 56] SAT Solving starts:
c [Signal] Signal interruption. Caught signal: SIGTERM (15).
c [w = 65] Start task in PID: 7005.
c [w = 65] Cyclic Antibandwidth problem with w = 65 (R-dwt__503.mtx.rnd):
c [w = 65] Initializing CaDiCaL (version 2.1.3).
c [w = 65] Configuring CaDiCaL as --sat (1).
c [w = 65] Encoding starts with w = 65:
c [w = 65] Symmetry breaking highest degree node is applied.
c [w = 65] Encoding duration: 4968 ms.
c [w = 65] Number of clauses: 8122803.
c [w = 65] Number of variables: 798764.
c [w = 65] SAT Solving starts:
c [Signal] Signal interruption. Caught signal: SIGTERM (15).
c [w = 59] Start task in PID: 7001.
c [w = 59] Cyclic Antibandwidth problem with w = 59 (R-dwt__503.mtx.rnd):
c [w = 59] Initializing CaDiCaL (version 2.1.3).
c [w = 59] Configuring CaDiCaL as --sat (1).
c [w = 59] Encoding starts with w = 59:
c [w = 59] Symmetry breaking highest degree node is applied.
c [w = 59] Encoding duration: 5033 ms.
c [w = 59] Number of clauses: 8128098.
c [w = 59] Number of variables: 802788.
c [w = 59] SAT Solving starts:
c [Signal] Signal interruption. Caught signal: SIGTERM (15).
c [Main] Lim pid ends with result: 254.
c [Main] All children have completed.
r [Main] 
r [Main] Final results: 
r [Main] Max width SAT:  	53.
r [Main] Min width UNSAT:	-.
r [Main] Total real time: 151003 ms.
r [Main] Total memory consumed: 15122.9 MB.
r [Main] 
c [w = 57] Start task in PID: 7021.
c [w = 57] Cyclic Antibandwidth problem with w = 57 (R-dwt__503.mtx.rnd):
c [w = 57] Initializing CaDiCaL (version 2.1.3).
c [w = 57] Configuring CaDiCaL as --sat (1).
c [w = 57] Encoding starts with w = 57:
c [w = 57] Symmetry breaking highest degree node is applied.
c [w = 57] Encoding duration: 4848 ms.
c [w = 57] Number of clauses: 8099930.
c [w = 57] Number of variables: 793734.
c [w = 57] SAT Solving starts:
c [Signal] Signal interruption. Caught signal: SIGTERM (15).
c [w = 60] Start task in PID: 7023.
c [w = 60] Cyclic Antibandwidth problem with w = 60 (R-dwt__503.mtx.rnd):
c [w = 60] Initializing CaDiCaL (version 2.1.3).
c [w = 60] Configuring CaDiCaL as --sat (1).
c [w = 60] Encoding starts with w = 60:
c [w = 60] Symmetry breaking highest degree node is applied.
c [w = 60] Encoding duration: 4971 ms.
c [w = 60] Number of clauses: 8142182.
c [w = 60] Number of variables: 807315.
c [w = 60] SAT Solving starts:
c [Signal] Signal interruption. Caught signal: SIGTERM (15).
