c [Version] Cyclic Bandwidth Encoder version 1.0.0.
c [Param] Real time limit is set to 150.
c [Param] Memory limit is set to 30000.
c [Param] Worker count is set to 8.
c [Main] Encoding and solving for graph: cbt_500.txt.
c [Main] Search strategy: Binary search using BFS.
c [Main] No predefined lower bound is found for cbt_500.txt.
c [Main] LB-w = 2 (default value).
c [Main] No predefined upper bound is found for cbt_500.txt.
c [Main] UB-w = 250 (default value calculated as n/2).
c [Main] Search order: 126 63 188 32 94 157 219 16 47 78 110 141 172 203 235 8 24 39 55 70 86 102 118 133 149 164 180 195 211 227 243 4 12 20 28 35 43 51 59 66 74 82 90 98 106 114 122 129 137 145 153 160 168 176 184 191 199 207 215 223 231 239 247 2 6 10 14 18 22 26 30 33 37 41 45 49 53 57 61 64 68 72 76 80 84 88 92 96 100 104 108 112 116 120 124 127 131 135 139 143 147 151 155 158 162 166 170 174 178 182 186 189 193 197 201 205 209 213 217 221 225 229 233 237 241 245 249 3 5 7 9 11 13 15 17 19 21 23 25 27 29 31 34 36 38 40 42 44 46 48 50 52 54 56 58 60 62 65 67 69 71 73 75 77 79 81 83 85 87 89 91 93 95 97 99 101 103 105 107 109 111 113 115 117 119 121 123 125 128 130 132 134 136 138 140 142 144 146 148 150 152 154 156 159 161 163 165 167 169 171 173 175 177 179 181 183 185 187 190 192 194 196 198 200 202 204 206 208 210 212 214 216 218 220 222 224 226 228 230 232 234 236 238 240 242 244 246 248 250.
c [w = 63] Start task in PID: 197614.
c [w = 63] Cyclic Antibandwidth problem with w = 63 (cbt_500.txt):
c [w = 63] Initializing CaDiCaL (version 2.1.3).
c [w = 63] Configuring CaDiCaL as --sat (1).
c [w = 63] Encoding starts with w = 63:
c [w = 63] Symmetry breaking highest degree node is applied.
c [w = 63] Encoding duration: 2415 ms.
c [w = 63] Number of clauses: 3566774.
c [w = 63] Number of variables: 783000.
c [w = 63] SAT Solving starts:
c [w = 63] Solving duration: 282 ms.
c [w = 63] Answer:
s [w = 63] SAT (w = 63).
c [w = 63] Solution check = 63.
c [w = 63] The solution is correct.
c [w = 63] Result: 10.
c [Main] Max width SAT is set to 63.
c [Main] Kill lower pid 16.
c [Main] Kill lower pid 32.
c [w = 16] Start task in PID: 197620.
c [w = 16] Cyclic Antibandwidth problem with w = 16 (cbt_500.txt):
c [w = 16] Initializing CaDiCaL (version 2.1.3).
c [w = 16] Configuring CaDiCaL as --sat (1).
c [w = 16] Encoding starts with w = 16:
c [w = 16] Symmetry breaking highest degree node is applied.
c [w = 16] Encoding duration: 2455 ms.
c [w = 16] Number of clauses: 3657346.
c [w = 16] Number of variables: 751000.
c [w = 16] SAT Solving starts:
c [w = 16] Solving duration: 294 ms.
c [w = 16] Answer:
s [w = 16] SAT (w = 16).
c [w = 16] Solution check = 16.
c [w = 16] The solution is correct.
c [Signal] Signal interruption. Caught signal: SIGTERM (15).
c [w = 32] Start task in PID: 197616.
c [w = 32] Cyclic Antibandwidth problem with w = 32 (cbt_500.txt):
c [w = 32] Initializing CaDiCaL (version 2.1.3).
c [w = 32] Configuring CaDiCaL as --sat (1).
c [w = 32] Encoding starts with w = 32:
c [w = 32] Symmetry breaking highest degree node is applied.
c [w = 32] Encoding duration: 2431 ms.
c [w = 32] Number of clauses: 3565298.
c [w = 32] Number of variables: 775000.
c [w = 32] SAT Solving starts:
c [w = 32] Solving duration: 289 ms.
c [w = 32] Answer:
s [w = 32] SAT (w = 32).
c [w = 32] Solution check = 32.
c [w = 32] The solution is correct.
c [Signal] Signal interruption. Caught signal: SIGTERM (15).
c [Main] Child pid 32 - 197616 terminated by signal 15.
c [w = 94] Start task in PID: 197617.
c [w = 94] Cyclic Antibandwidth problem with w = 94 (cbt_500.txt):
c [w = 94] Initializing CaDiCaL (version 2.1.3).
c [w = 94] Configuring CaDiCaL as --sat (1).
c [w = 94] Encoding starts with w = 94:
c [w = 94] Symmetry breaking highest degree node is applied.
c [w = 94] Encoding duration: 2498 ms.
c [w = 94] Number of clauses: 3676768.
c [w = 94] Number of variables: 816000.
c [w = 94] SAT Solving starts:
c [w = 94] Solving duration: 305 ms.
c [w = 94] Answer:
s [w = 94] SAT (w = 94).
c [w = 94] Solution check = 94.
c [w = 94] The solution is correct.
c [w = 94] Result: 10.
c [Main] Child pid 16 - 197620 terminated by signal 15.
c [Main] Max width SAT is set to 94.
c [Main] Kill lower pid 78.
c [w = 78] Start task in PID: 197623.
c [w = 78] Cyclic Antibandwidth problem with w = 78 (cbt_500.txt):
c [w = 78] Initializing CaDiCaL (version 2.1.3).
c [w = 78] Configuring CaDiCaL as --sat (1).
c [w = 78] Encoding starts with w = 78:
c [w = 78] Symmetry breaking highest degree node is applied.
c [Signal] Signal interruption. Caught signal: SIGTERM (15).
c [Main] Child pid 78 - 197623 terminated by signal 15.
c [w = 126] Start task in PID: 197613.
c [w = 126] Cyclic Antibandwidth problem with w = 126 (cbt_500.txt):
c [w = 126] Initializing CaDiCaL (version 2.1.3).
c [w = 126] Configuring CaDiCaL as --sat (1).
c [w = 126] Encoding starts with w = 126:
c [w = 126] Symmetry breaking highest degree node is applied.
c [w = 126] Encoding duration: 2439 ms.
c [w = 126] Number of clauses: 3609262.
c [w = 126] Number of variables: 789000.
c [w = 126] SAT Solving starts:
c [w = 126] Solving duration: 737 ms.
c [w = 126] Answer:
s [w = 126] SAT (w = 126).
c [w = 126] Solution check = 126.
c [w = 126] The solution is correct.
c [w = 126] Result: 10.
c [Main] Max width SAT is set to 126.
c [Main] Kill lower pid 110.
c [w = 110] Start task in PID: 197624.
c [w = 110] Cyclic Antibandwidth problem with w = 110 (cbt_500.txt):
c [w = 110] Initializing CaDiCaL (version 2.1.3).
c [w = 110] Configuring CaDiCaL as --sat (1).
c [w = 110] Encoding starts with w = 110:
c [w = 110] Symmetry breaking highest degree node is applied.
c [Signal] Signal interruption. Caught signal: SIGTERM (15).
c [Main] Child pid 110 - 197624 terminated by signal 15.
c [w = 141] Start task in PID: 197625.
c [w = 141] Cyclic Antibandwidth problem with w = 141 (cbt_500.txt):
c [w = 141] Initializing CaDiCaL (version 2.1.3).
c [w = 141] Configuring CaDiCaL as --sat (1).
c [w = 141] Encoding starts with w = 141:
c [w = 141] Symmetry breaking highest degree node is applied.
c [w = 141] Encoding duration: 2554 ms.
c [w = 141] Number of clauses: 3706762.
c [w = 141] Number of variables: 819000.
c [w = 141] SAT Solving starts:
c [w = 141] Solving duration: 763 ms.
c [w = 141] Answer:
s [w = 141] SAT (w = 141).
c [w = 141] Solution check = 141.
c [w = 141] The solution is correct.
c [w = 141] Result: 10.
c [Main] Max width SAT is set to 141.
c [Main] Kill lower pid 133.
c [w = 133] Start task in PID: 197629.
c [w = 133] Cyclic Antibandwidth problem with w = 133 (cbt_500.txt):
c [w = 133] Initializing CaDiCaL (version 2.1.3).
c [w = 133] Configuring CaDiCaL as --sat (1).
c [w = 133] Encoding starts with w = 133:
c [w = 133] Symmetry breaking highest degree node is applied.
c [w = 133] Encoding duration: 2414 ms.
c [w = 133] Number of clauses: 3654762.
c [w = 133] Number of variables: 803000.
c [w = 133] SAT Solving starts:
c [w = 133] Solving duration: 782 ms.
c [w = 133] Answer:
s [w = 133] SAT (w = 133).
c [w = 133] Solution check = 133.
c [w = 133] The solution is correct.
c [Signal] Signal interruption. Caught signal: SIGTERM (15).
c [Main] Child pid 133 - 197629 terminated by signal 15.
c [w = 149] Start task in PID: 197630.
c [w = 149] Cyclic Antibandwidth problem with w = 149 (cbt_500.txt):
c [w = 149] Initializing CaDiCaL (version 2.1.3).
c [w = 149] Configuring CaDiCaL as --sat (1).
c [w = 149] Encoding starts with w = 149:
c [w = 149] Symmetry breaking highest degree node is applied.
c [w = 149] Encoding duration: 2534 ms.
c [w = 149] Number of clauses: 3758762.
c [w = 149] Number of variables: 835000.
c [w = 149] SAT Solving starts:
c [w = 149] Solving duration: 906 ms.
c [w = 149] Answer:
s [w = 149] SAT (w = 149).
c [w = 149] Solution check = 149.
c [w = 149] The solution is correct.
c [w = 149] Result: 10.
c [Main] Max width SAT is set to 149.
c [w = 164] Start task in PID: 197631.
c [w = 164] Cyclic Antibandwidth problem with w = 164 (cbt_500.txt):
c [w = 164] Initializing CaDiCaL (version 2.1.3).
c [w = 164] Configuring CaDiCaL as --sat (1).
c [w = 164] Encoding starts with w = 164:
c [w = 164] Symmetry breaking highest degree node is applied.
c [w = 164] Encoding duration: 2541 ms.
c [w = 164] Number of clauses: 3856262.
c [w = 164] Number of variables: 865000.
c [w = 164] SAT Solving starts:
c [Signal] Signal interruption. Caught signal: SIGTERM (15).
c [w = 203] Start task in PID: 197627.
c [w = 203] Cyclic Antibandwidth problem with w = 203 (cbt_500.txt):
c [w = 203] Initializing CaDiCaL (version 2.1.3).
c [w = 203] Configuring CaDiCaL as --sat (1).
c [w = 203] Encoding starts with w = 203:
c [w = 203] Symmetry breaking highest degree node is applied.
c [w = 203] Encoding duration: 2601 ms.
c [w = 203] Number of clauses: 3809259.
c [w = 203] Number of variables: 843000.
c [w = 203] SAT Solving starts:
c [Signal] Signal interruption. Caught signal: SIGTERM (15).
c [w = 235] Start task in PID: 197628.
c [w = 235] Cyclic Antibandwidth problem with w = 235 (cbt_500.txt):
c [w = 235] Initializing CaDiCaL (version 2.1.3).
c [w = 235] Configuring CaDiCaL as --sat (1).
c [w = 235] Encoding starts with w = 235:
c [w = 235] Symmetry breaking highest degree node is applied.
c [w = 235] Encoding duration: 2694 ms.
c [w = 235] Number of clauses: 3969259.
c [w = 235] Number of variables: 891000.
c [w = 235] SAT Solving starts:
c [Signal] Signal interruption. Caught signal: SIGTERM (15).
c [w = 157] Start task in PID: 197618.
c [w = 157] Cyclic Antibandwidth problem with w = 157 (cbt_500.txt):
c [w = 157] Initializing CaDiCaL (version 2.1.3).
c [w = 157] Configuring CaDiCaL as --sat (1).
c [w = 157] Encoding starts with w = 157:
c [w = 157] Symmetry breaking highest degree node is applied.
c [w = 157] Encoding duration: 2605 ms.
c [w = 157] Number of clauses: 3810762.
c [w = 157] Number of variables: 851000.
c [w = 157] SAT Solving starts:
c [Signal] Signal interruption. Caught signal: SIGTERM (15).
c [w = 188] Start task in PID: 197615.
c [w = 188] Cyclic Antibandwidth problem with w = 188 (cbt_500.txt):
c [w = 188] Initializing CaDiCaL (version 2.1.3).
c [w = 188] Configuring CaDiCaL as --sat (1).
c [w = 188] Encoding starts with w = 188:
c [w = 188] Symmetry breaking highest degree node is applied.
c [w = 188] Encoding duration: 2522 ms.
c [w = 188] Number of clauses: 3734259.
c [w = 188] Number of variables: 820500.
c [w = 188] SAT Solving starts:
c [Signal] Signal interruption. Caught signal: SIGTERM (15).
c [w = 219] Start task in PID: 197619.
c [w = 219] Cyclic Antibandwidth problem with w = 219 (cbt_500.txt):
c [w = 219] Initializing CaDiCaL (version 2.1.3).
c [w = 219] Configuring CaDiCaL as --sat (1).
c [w = 219] Encoding starts with w = 219:
c [w = 219] Symmetry breaking highest degree node is applied.
c [w = 219] Encoding duration: 2679 ms.
c [w = 219] Number of clauses: 3889259.
c [w = 219] Number of variables: 867000.
c [w = 219] SAT Solving starts:
c [Signal] Signal interruption. Caught signal: SIGTERM (15).
c [w = 180] Start task in PID: 197632.
c [w = 180] Cyclic Antibandwidth problem with w = 180 (cbt_500.txt):
c [w = 180] Initializing CaDiCaL (version 2.1.3).
c [w = 180] Configuring CaDiCaL as --sat (1).
c [w = 180] Encoding starts with w = 180:
c [w = 180] Symmetry breaking highest degree node is applied.
c [w = 180] Encoding duration: 2443 ms.
c [w = 180] Number of clauses: 3694259.
c [w = 180] Number of variables: 808500.
c [w = 180] SAT Solving starts:
c [Signal] Signal interruption. Caught signal: SIGTERM (15).
c [Main] Lim pid ends with result: 254.
c [Main] All children have completed.
r [Main] 
r [Main] Final results: 
r [Main] Max width SAT:  	149.
r [Main] Min width UNSAT:	-.
r [Main] Total real time: 151063 ms.
r [Main] Total memory consumed: 8774.8 MB.
r [Main] 
c [w = 172] Start task in PID: 197626.
c [w = 172] Cyclic Antibandwidth problem with w = 172 (cbt_500.txt):
c [w = 172] Initializing CaDiCaL (version 2.1.3).
c [w = 172] Configuring CaDiCaL as --sat (1).
c [w = 172] Encoding starts with w = 172:
c [w = 172] Symmetry breaking highest degree node is applied.
c [w = 172] Encoding duration: 2376 ms.
c [w = 172] Number of clauses: 3654259.
c [w = 172] Number of variables: 796500.
c [w = 172] SAT Solving starts:
c [Signal] Signal interruption. Caught signal: SIGTERM (15).
